URL,Source,Language,Published_Date,Is_Premium,Keyword_Matched,Article_Classification,Headline,Intro,Content,Content_Length,Sentence_Count,Actors,Actor_Count,Author
https://www.faz.net/aktuell/wirtschaft/wo-trump-richtig-liegt-die-klimakrise-konkurriert-mit-der-erschwinglichkeitskrise-und-letztere-scheint-zu-gewinnen-110836363.html,FAZ,de,"13.02.2026, 11:10",False,klima,Climate_Geopolitics,Wo Trump richtig liegt: Die Klimakrise konkurriert mit der Erschwinglichkeitskrise – und letztere scheint zu gewinnen.,"Klimaaktivisten haben die Öffentlichkeit vielleicht davon überzeugt, die Erderwärmung ernstzunehmen. Aber sie konnten sie nicht davon überzeugen, für den Klimaschutz zu bezahlen.","Klimaaktivisten haben die Öffentlichkeit vielleicht davon überzeugt, die Erderwärmung ernstzunehmen. Aber sie konnten sie nicht davon überzeugen, für den Klimaschutz zu bezahlen. Globale Empörung ist wieder programmiert, weil Donald Trump Ernst damit macht, die Klimapolitik zu beenden. Er hegt nicht nur Zweifel daran, dass die Erderwärmung Folge menschlicher Aktivität ist. Er glaubt auch, dass der Alarmismus wirtschaftlichen Spezialinteressen dient, dass Klimaauflagen Energie verteuern und dem Wirtschaftsstandort schaden, ohne nennenswerten Einfluss auf die globalen Emissionen zu haben. Lithium war als kritischer Batterierohstoff bislang unersetzlich. Doch nun gibt es eine Alternative. Sie ist auch für Europa und seine Industrie eine Chance. BASF-Chef Markus Kamieth ist derzeit Präsident des europäischen Chemieverbands Cefic. Im Gespräch zeichnet er ein düsteres Bild der Lage der Industrie. Von den Regierungschefs der EU fordert er schnelle Reformen. Die vier großen US-Techkonzerne wollen in diesem Jahr 650 Milliarden Dollar in KI-Rechenzentren investieren. Hat es ähnlich hohe Infrastrukturinvestitionen schon mal gegeben? Eine Spurensuche.",1157,14,"Batterierohstoff, Donald Trump Ernst, KI-Rechenzentren, Klimaaktivisten, Klimaauflagen Energie, Lithium, Markus Kamieth, Regierungschefs der EU",8,"Petersdorff,Winand von"
https://www.faz.net/aktuell/technik-motor/schlusslicht-technik-begeistert-accg-110831753.html,FAZ,de,"08.02.2026, 07:50",False,klima,Climate_Geopolitics,Schlusslicht: Technik begeistert,"Nicht alles läuft in Deutschland schlecht. Frau Dröge von den Grünen hat supergute Nachrichten zur „Energiewende“. Wenn sich der Staat raushält, klappt es auch mit der Technik.","Nicht alles läuft in Deutschland schlecht. Frau Dröge von den Grünen hat supergute Nachrichten zur „Energiewende“. Wenn sich der Staat raushält, klappt es auch mit der Technik. Positiv überrascht zu werden, das ist in der Welt der Technik und in Deutschland eher selten. Jeden Tag nicht nur trübes Wetter, sondern auch schlechte Nachrichten. Das Tanken am Montagmorgen ist sündhaft teuer, die Goldpreise brechen ein, und die EU nimmt wieder einmal neue Dienste für eine umfassende Regulierung ins Visier. Zugleich bringt sie so viele Gesetze wie seit 15 Jahren nicht mehr auf den Weg. Wir ersticken in Bürokratie, die Unternehmen kommen in der Umsetzung nicht mehr nach. Doch gibt es auch gute Nachrichten. Fallende Goldpreise sind eine schöne Gelegenheit zum Nachkaufen, wenn man die Nerven dazu hat. Und dann tritt endlich der ADAC-Verkehrspräsident zurück, er befürwortete hohe Spritpreise fürs Klima. Doch es kommt noch besser. Die Grünen-Politikerin Katharina Dröge weiß zu berichten, dass „unsere Energiewende“ in der ganzen Welt kopiert werde. „Auch weil der rasante Ausbau der erneuerbaren Energien die Kosten senkt.“ Wir freuen uns auf die sofortige Einstellung aller Subventionen aus Steuerzahlerhand und auf die Jahresabrechnung des Stromversorgers mit einer üppigen Rückerstattung. Die würden wir gleich in Gold und eine ADAC-Mitgliedschaft investieren. Es gibt nur einen großen deutschen Skihersteller – Völkl. Der will sein Neongelb endlich wieder im Rennsport zum Leuchten bringen. Und auch sonst tut sich einiges unter dem neuen Chef. Die jüngste Apple Watch nutzt erstmals Redcap im 5G-Netz. Das ist abgespeckte Technik für längere Laufzeiten. Auch andere Anwendungen profitieren. Der Škoda Superb hat als Plug-in-Hybrid nicht nur steuerliche Reize. Aber es gilt, genau zu rechnen. Und auf die Jahreszeit zu achten.",1832,25,"ADAC-Verkehrspräsident, Dröge, EU, Katharina Dröge, Redcap, Völkl, den Grünen",7,"Spehr,Michael"
https://www.faz.net/pro/weltwirtschaft/klima-ressourcen/wadephul-im-suedpazifik-warum-die-region-fuer-deutschland-wichtig-ist-accg-200506350.html,FAZ,de,"05.02.2026, 16:16",False,klima,Climate_Geopolitics,Wadephul im Südpazifik: Warum die Region für Deutschland wichtig ist,Für Berlin spielten die Inselstaaten im Südpazifik bislang keine zentrale Rolle. Dabei gäbe es gute Gründe dafür – von der Konkurrenz mit China bis hin zur Klimapolitik. Allerdings sollten die deutschen Diplomaten mehrere Fehler nicht wiederholen.,"Für Berlin spielten die Inselstaaten im Südpazifik bislang keine zentrale Rolle. Dabei gäbe es gute Gründe dafür – von der Konkurrenz mit China bis hin zur Klimapolitik. Allerdings sollten die deutschen Diplomaten mehrere Fehler nicht wiederholen. Es ist bemerkenswert, dass Außenminister Johann Wadephuls Reise in den Indopazifik auch die Aufnahme diplomatischer Beziehungen zum Inselstaat Niue einschließt und ihn nach Tonga führt. Jedoch treffen dort mehrere Entwicklungen zusammen, die Berlin derzeit beschäftigen: Mittelmächte-Diplomatie, Klimapolitik, strategische Rivalität, Desinformation und die Zukunft der multilateralen Ordnung. Deutschland und Europa müssen neue Partner suchen, um für diese Themen globale Unterstützung zu mobilisieren, weil internationale Gewissheiten schwinden und selbst transatlantische Verlässlichkeit nicht mehr gegeben ist. Deshalb lohnt sich der Blick in diese Region. Dieser Text stammt aus F.A.Z. PRO Weltwirtschaft. Erhalten Sie jeden Donnerstag das Briefing mit allem Wichtigen zu Globalisierung, Sicherheit und Ressourcen. Zusätzlich können Sie auf alle FAZ+ Artikel zugreifen. Ein naheliegender Grund, weshalb die pazifischen Inselstaaten (Pacific Island Countries, PICs) an Bedeutung gewinnen sollten, ist, dass sie für Deutschlands engste und gleichgesinnte Partner in der Region – Australien und Neuseeland – von zentraler Relevanz sind. Für Canberra und Wellington sind die Inselstaaten nicht „weit weg“. Sie bilden ihr unmittelbares strategisches Umfeld, besonders für Neuseeland. Stabilität im Pazifik ist für sie keine abstrakte Frage globaler Ordnung, sondern regionaler Ordnung vor der eigenen Haustür. Beide Hauptstädte beobachten mit wachsender Sorge, wie China seine Präsenz durch Investitionen, Infrastrukturprojekte und teils auch sicherheitspolitische Beziehungen ausweitet. Zugleich sind sie beunruhigt durch die Volatilität der Vereinigten Staaten. Die Biden-Regierung hatte eine stärkere Fokussierung auf den Südpazifik angekündigt. Doch die Rückkehr Trumps – und mit ihr der Rückzug von Hilfsleistungen, die Verachtung für „shithole countries“, wie Donald Trump sagt, sowie die Ungeduld gegenüber multilateralen Formaten – hat pazifischen Regierungen erneut vor Augen geführt, dass die USA nicht immer ein verlässlicher Faktor sind. Peking versucht in einem solchen Umfeld offensichtlich, strategische Vorteile zu gewinnen. Chinas Entwicklungshilfe im Pazifik ist seit ihrem Höhepunkt Mitte der 2010er-Jahre deutlich zurückgegangen – von rund 384 Millionen US-Dollar im Jahr 2016 auf etwa 231 Millionen Dollar bis 2024. Die verbleibende Unterstützung wird inzwischen gezielter auf politisch entscheidende Staaten konzentriert, wie die Salomonen oder Kiribati. Dort fungiert Hilfe zunehmend als Hebel politischer Einflussnahme. Dieser Ansatz hat Taiwans verbliebene Partnerschaften weiter erodiert: Während 2018 noch sechs pazifische Inselstaaten Taiwan offiziell anerkannten, hat sich diese Zahl seither halbiert. Für Deutschland vielleicht noch relevanter ist, dass auch Moskau bisweilen versucht hat, die diplomatische Kleinteiligkeit der Region auszunutzen: Zwar haben die PICs den russischen Angriffskrieg gegen die Ukraine überwiegend verurteilt. Doch in der Vergangenheit hatten einige pazifische Staaten zeitweise Abchasien und Südossetien anerkannt – von Russland besetzte georgische Territorien. Gleichzeitig verstehen sich die pazifischen Inselstaaten nicht primär als Spielfiguren in einem Großmachtkonflikt. Sie sind souveräne Akteure mit eigener Handlungsfähigkeit und betrachten viele ihrer zentralen Herausforderungen als weitgehend unabhängig von der geopolitischen Rivalität, die den Rest der Welt prägt. Ein Grund, weshalb sie ernster genommen werden sollten, liegt in ihrer Tendenz, international als Block aufzutreten. Manche europäische Staaten haben dies erkannt. Während ihres Wahlkampfs für einen Sitz im UN-Sicherheitsrat war Riga stark daran interessiert, Narrative rund um Klimapolitik und eine nichtkoloniale Vergangenheit zu entwickeln, um Lettland als attraktiven Kandidaten zu präsentieren. In einem solchen Wettbewerb sind die zwölf Stimmen der pazifischen Inselstaaten in der UN-Vollversammlung keineswegs trivial. Der Klimawandel ist eines der klarsten Felder der Konvergenz zwischen pazifischen Prioritäten und Deutschland. Für viele Regierungen der Region ist Klimasicherheit eine existenzielle Frage. Das lettische Beispiel zeigt zugleich, wie PICs ihre Agenda in multilateralen Foren vorantreiben können. Deutschlands Betonung von Dringlichkeit und globaler Verantwortung findet in Suva, der Hauptstadt der Fidschis, oder Nuku'alofa (Tonga) oft stärkere Resonanz als in Canberra. Dies gilt selbst unter der Merz-Regierung, die Klimapolitik stärker mit Industrie- und Energiefragen ausbalanciert. Auch Desinformation und wachsende Cybersicherheitsrisiken sind im Pazifik drängende Themen. Kleine Medienökosysteme, hohe Social-Media-Durchdringung und begrenzte technische Kapazitäten machen viele Gesellschaften anfällig für externe Einflussnahme und digitale Manipulation. Deutschlands Engagement in der Region konzentrierte sich traditionell auf Klima und Entwicklung. Doch Berlins breiterer Fokus auf demokratische Resilienz, digitale Governance und das Eindämmen autoritärer Einflussnahme bietet einen natürlichen Anknüpfungspunkt, während pazifische Staaten sich in einem zunehmend umkämpften digitalen Umfeld bewegen. Deutschland beginnt, dem Pazifik mehr Aufmerksamkeit zu schenken: 2023 wurde eine Botschaft in Suva eröffnet, und die dafür zuständige Pazifikbeauftragte, Beate Grzeski, ist inzwischen Botschafterin in Canberra. Berlin setzt erfahrene Diplomaten auf pazifikbezogene Posten. Auch die symbolische Geste ministerieller Reisen gehört dazu. Gleichwohl treten europäische Besucher im Pazifik mitunter mit Vorträgen über Governance, Demokratie und Werten auf. Das beeindruckt dort niemanden. Gebildete pazifische Eliten haben häufig in Canberra, Auckland oder Wellington studiert und sind mit westlichen politischen Formen bestens vertraut. Worum es in der Region weniger geht, sind Belehrungen über demokratische Standards, sondern um konkrete Unterstützung beim Umgang mit sehr praktischen Herausforderungen – von administrativen Kapazitäten bis zu digitaler Resilienz. Was Europäer zudem häufig anbieten, ist Entwicklungshilfe, die an Berichtspflichten und übermäßige Bürokratie geknüpft ist – Anforderungen, die kleine, gering ausgestattete Behörden kaum bewältigen können. Auch das sollte berücksichtigt werden. Die Inselstaaten benötigen Partner, die zuhören, administrative Grenzen verstehen und praktische Kooperation sowie Lösungen anbieten, statt zusätzliche Belastungen zu schaffen. Deutschland sollte seine regionale Präsenz ausbauen, sich sinnvoll mit Australien und Neuseeland abstimmen und Alternativen in der Entwicklungszusammenarbeit bereitstellen. Damit diese Unterstützung glaubwürdig nachhaltig ist, muss sie an gemeinsame Ziele angepasst sein. Vor allem aber sollte Deutschland pazifische Staaten nicht als Schachfiguren oder als Bühne europäischer Tugend verstehen. Die pazifischen Inselstaaten sind eigenständige Akteure. Bei seiner Reise im Indopazifik sagt Außenminister Wadephul: Man entfremde sich von den USA, laufe aber auch nicht mit offenen Armen auf China zu. Was also tun? In der Wissenschaft geht die Angst davor um, allzu offen mit den eigenen Daten umzugehen. Wie kann die Forschung unter neuen globalen Bedingungen geschützt werden? Der Wissenschaftsrat macht Vorschläge. Auf der Münchner Sicherheitskonferenz geht es um Sicherheit und Wohlstand. Viele Menschen trauen den Versprechen der etablierten Parteien nicht mehr – und akzeptieren, wenn sich bewährte politische Strukturen ändern.",7743,65,"Donald Trump, Johann Wadephuls, PICs, UN-Sicherheitsrat",4,
https://www.faz.net/aktuell/wissen/wie-man-das-kohlendioxid-aus-der-atmosphaere-bekommt-accg-110828178.html,FAZ,de,"03.02.2026, 12:57",False,klima,Climate_Science,Wie man das Kohlendioxid aus der Atmosphäre bekommt,"Um Kohlendioxid aus der Atmosphäre zu fischen, werden Bäume gefällt und im Erdboden verbuddelt. Das kostet viel Platz. Nun präsentieren Forscher ein eleganteres Konzept.","Um Kohlendioxid aus der Atmosphäre zu fischen, werden Bäume gefällt und im Erdboden verbuddelt. Das kostet viel Platz. Nun präsentieren Forscher ein eleganteres Konzept. Bäume sind wichtige Verbündete im Kampf gegen den Klimawandel. Sie ziehen Kohlenstoff(dioxid) aus der Atmosphäre und lagern ihn dauerhaft in Stamm und Ästen ein. Je mehr Bäume wachsen, umso besser. Der Trend weltweit sieht bekanntlich aber nicht gut aus: Geschätzt 13 Millionen Hektar Wald verschwinden pro Jahr von der Erde. Wenn Bäume gefällt werden, werden sie in der Regel nicht zu lange haltbaren Tischen, Dachstühlen oder Blockhäusern verarbeitet, sondern verrotten oder verbrennen. Der Kohlenstoff wird dann wieder frei – Klimaschützer haben Pech gehabt. Auf unserem Nachbarplaneten haben Forscher ein Loch im Boden entdeckt. Es offenbart einen enormen unterirdischen Hohlraum. Pestizide setzen der Artenvielfalt zu. Denn die wirken immer stärker – und nicht nur gegen Schädlinge. In Skandinavien, China und Japan ist es allerdings gelungen, die Belastungen zu senken. Hoher Blutdruck ist ein stiller, unbemerkter Killer. Smartwatches können davor warnen. Wie gut sind diese Messungen?",1162,18,,0,"Heinemann,Pia"
https://www.faz.net/aktuell/rhein-main/region-und-hessen/kommunalwahl-2026-in-offenbach-das-steht-im-programm-der-gruenen-accg-200475245.html,FAZ,de,"30.01.2026, 09:34",False,klima,Climate_Geopolitics,Kommunalwahl 2026 in Offenbach: Das steht im Programm der Grünen,"Die Grünen in Offenbach wollen zur Kommunalwahl mit ihren angestammten Themen punkten: mehr Klimaschutz, weniger Autoverkehr, Grünflächen erhalten. Doch freie Flächen braucht die Stadt auch für vieles andere.","Die Grünen in Offenbach wollen zur Kommunalwahl mit ihren angestammten Themen punkten: mehr Klimaschutz, weniger Autoverkehr, Grünflächen erhalten. Doch freie Flächen braucht die Stadt auch für vieles andere. Da Offenbach mit 4500 Hektar die flächenmäßig kleinste Großstadt Hessens ist, sind nutzbare Flächen ein rares Gut. Erklärtes Ziel der Grünen in Offenbach ist es, möglichst keine weiteren Flächen mit Beton zu verschließen und Naturflächen in der Stadt zu erhalten, um die Stadt widerstandsfähiger gegenüber der Klimaveränderung mit steigender Erwärmung im Sommer und drohender Wasserknappheit zu machen. Dieses Ziel muss allerdings mit zwei anderen im Kommunalwahlprogramm der Partei genannten Zielen vereinbart werden: So wollen die Grünen zugleich in den kommenden fünf Jahren den nach wie vor akuten Bedarf an Wohnraum decken, den auch Menschen mit geringen und mittleren Einkommen noch bezahlen können. Influencer richten sich oft an ein junges Publikum – aber nicht nur. Niklas Hartmann sucht die Richtigen für seine Kunden. Der Markt für E-Autos wächst. Schon jetzt sind sie in einigen Fällen günstiger als vergleichbare Verbrennermodelle. Die neue Prämie kann sie noch attraktiver machen. Diese Rechnungen zeigen, für wen sich der Umstieg nun lohnt. Birken ade: Regisseur Philipp Preuss zaust Tschechows „Kirschgarten“ am Staatstheater Darmstadt bildstark, aber gefühlsarm. Flughafenredakteur und Korrespondent der Rhein-Main-Zeitung für Rhein-Main-Süd.",1468,15,"E-Autos, Niklas Hartmann, Philipp Preuss, die Grünen",4,
https://www.faz.net/aktuell/politik/briefe-an-die-herausgeber/faz-briefe-an-die-herausgeber-vom-29-januar-2026-accg-110826737.html,FAZ,de,"29.01.2026, 07:00",False,klima,Climate_Geopolitics,FAZ: Briefe an die Herausgeber vom 29. Januar 2026,CSU-Klausurtagung +++ Lob für Berichterstattung +++ Jagd auf Wölfe +++ Umwelt-Studie +++ Carlo Emilio Gaddas Journal +++ Kluge Köpfe +++ Ku‘Damm ‘77 im ZDF,"CSU-Klausurtagung +++ Lob für Berichterstattung +++ Jagd auf Wölfe +++ Umwelt-Studie +++ Carlo Emilio Gaddas Journal +++ Kluge Köpfe +++ Ku‘Damm ‘77 im ZDF Zu dem Artikel „Einfach mal fordern, einfach mal singen“ von Timo Frasch in der F.A.Z. vom 14. Januar: Die Forderung des bayerischen Ministerpräsidenten nach Länderfusionen ist so alt wie richtig. Der Föderalismus würde erheblich gestärkt und immer wiederkehrende Vorwürfe der Kleinstaaterei entkräftet, würde die Zahl der Länder von 16 auf beispielsweise sieben reduziert. Nach Art. 29 Abs. 1 GG kann das Bundesgebiet neu gegliedert werden, um zu gewährleisten, dass die Länder nach Größe und Leistungsfähigkeit die ihnen obliegenden Aufgaben wirksam erfüllen können. Dabei sind die landsmannschaftliche Verbundenheit, die geschichtlichen und kulturellen Zusammenhänge, die wirtschaftliche Zweckmäßigkeit sowie die Erfordernisse der Raumordnung und der Landesplanung zu berücksichtigen. Demzufolge könnten die drei einwohnerstärksten Länder unverändert bleiben und folgende neue Länder gebildet werden: 1. Hessen mit Rheinland-Pfalz und dem Saarland; 2. Niedersachsen mit Schleswig-Holstein, Hamburg und Bremen; 3. Berlin mit Brandenburg und Mecklenburg-Vorpommern und 4. Sachsen mit Thüringen und Sachsen-Anhalt. Ein derartiger schlanker, schlagkräftiger Staat tut not. Es ist zu erwarten, dass auch die Mehrheit des jeweiligen Landesvolkes dies so sieht und erforderliche Volksentscheide – im Gegensatz zu 1996 in Brandenburg – erfolgreich im Sinne einer Fusion verlaufen.
Sebastian Siemer, Lichtenau Die Beiträge „Gas statt Bremse“ von Eckart Lohse und Matthias Wyssuwa und „Auf wen hört Merz?“ von Eckart Lohse über den Austausch des Büroleiters des Bundeskanzlers (F.A.Z. vom 7. Januar) stehen wie viele andere Artikel für den exzellenten und zugleich unaufgeregten Journalismus der F.A.Z.: eigene sehr gute, breite Recherche statt oberflächlicher Berichterstattung, fundierter Hintergrund und klar davon getrennt Bewertung und Kommentierung. Ein solcher Journalismus ist gerade in diesen Zeiten wertvoller denn je. Glückwunsch an die F.A.Z. und insbesondere auch an uns Leserinnen und Leser.
Dr. Dieter Gamber, Leitender Ministerialrat a. D., München Zu dem Kommentar „Wölfe und Menschen“ von Stephan Löwenstein (F.A.Z. vom 16. Januar): Der Wolf gehört nicht in das „Allgemeine Jagdrecht“. Ein bisher streng geschütztes, scheues Wildtier der Freizeitjagd zu unterstellen, ist ökologisch unbegründet und ethisch nicht vertretbar. Ich erlebe im Naturpark Müritz, wo mehrere Wolfsrudel leben, dass Menschen, die stundenlange Wanderungen unternehmen, niemals einen Wolf zu Gesicht bekommen haben. Ein deutlicher Hinweis auf die Scheu dieser Tiere, die sicher aus der historischen Verfolgung bis hin zur barbarischen Ausrottung ihrer Art resultiert. Herdenhunde zu halten, wäre ökologisch und moralisch der bessere Weg.
Eva Fack, Bad Honnef Zur Glosse „Wölfe und Menschen“ in Ihrer Ausgabe vom 16. Januar: Kaum zu fassen – es ist geschafft! Das Thema Wölfe beschäftigt uns nun schon intensiv seit Anfang 2019! Niederösterreich hat es uns vor acht Jahren schon vorgemacht, indem der Wolf seit dem 1. November 2018 im niederösterreichischen Jagdgesetz so verankert ist, dass ein Abschuss einzelner Wölfe möglich ist. Nach über achtjährigem Stillstand bei uns in dieser Frage ist nun anscheinend auch der letzte Wolfsfreund zu der Erkenntnis gekommen, dass die Konflikte über Jahre verharmlost worden sind und der rasante Populationszuwachs der Wölfe ohne Bestandsregulierung nicht mehr beherrschbar ist. Dabei wurde immer wieder vergessen, dass wir im Ganzen in einer dicht besiedelten, historisch entwickelten Kulturlandschaft leben, in der der Wolf keine natürlichen Feinde hat. Deshalb ist es umso besser, dass die Regulierung trotz politischer und gesellschaftlicher Spaltung in dieser Frage nun nicht mehr weiter hinausgezögert wird, um die Akzeptanz dieser Spezies bei der Bevölkerung und somit das Gebot des Artenschutzes nicht grundsätzlich zu gefährden.
Mark-Stanislaus von Busse, Leitender Forstdirektor a. D., Göttingen Zu dem Artikel „Umweltmüde Jugend“ von Katja Gelinsky in der F.A.Z. vom 10. Januar: Vielen Dank für den gelungenen Überblick zur Studie. Allerdings vermittelt die Studie mir persönlich einen eher manipulierenden Eindruck. Denn hier setzt das Umweltbundesamt (UBA) seine Sicht schon in den Fragen durch, um Umwelt (Natur) und so weiter zu vermischen. Denn die Liebe und Sorge um die Natur, als unsere unmittelbare Lebensgrundlage und fast täglich unmittelbar erfahrbar, und die Sorge um das Klima sind meines Erachtens zwei grundlegend unterschiedliche Gegenstände. Dazu gehört gerade die Klimapolitik als Steckenpferd des UBA, wie zum Beispiel die CO2-Politik inklusive des KTF-Fonds, in denen es um sehr viel Geld geht. Die Natur hingegen wird stiefmütterlich behandelt und in gewisser Weise sogar missbraucht zum Zweck des Klimaschutzes. Das sehr viel bessere Image der Natur wird für die Klimapolitik in Anspruch genommen. So wird versucht, das leidende Ansehen der Klimapolitik zu kaschieren. Wie oben angedeutet ist das nur mein persönlicher Eindruck, den ich Ihnen aber vermitteln möchte. Denn ich habe den Eindruck, dass den jungen Menschen die Natur – nach wie vor – sehr viel näher steht als die von politischen und finanziellen Interessen durchdrungene Klimapolitik. Dieser Einflussnahme scheint die Jugend überdrüssig zu werden, so mein Eindruck. Um dies zu vernebeln, missbraucht das UBA die Natur, die Liebe zur Heimat und so weiter.
Thomas Mock, Königswinter Zur Rezension der Kriegstagebücher Carlo Emilio Gaddas durch Niklas Bender und dem Verhältnis des italienischen Schriftstellers zu Deutschland („In Rage über das Gewinsel“, F.A.Z. vom 7. Januar): Der technikaffine Gadda verehrte Gottfried Wilhelm Leibniz. In seiner ursprünglich als Dissertation angelegten, unvollendeten „Mailänder Meditation“ aus den Jahren 1928/29 („Meditazione Milanese“) skizzierte er eine Erkenntnistheorie, die neben Kant und Spinoza vor allem auf die philosophischen Schriften von Leibniz Bezug nahm. Darin spiegelte sich seine zunehmende Faszination für Deutschland wider, die allerdings in den vierziger Jahren merklich abkühlte.
Dr. Jochen Trebesch, Berlin Die Sachlichkeit und der Weitblick des Leserbriefs „Trump, Grönland und die NATO“ (F.A.Z. vom 24. Januar) sind beeindruckend. Horst Ahlers bewegt sich außerhalb der kollektiven Hysterie und Ignoranz, die die Politik und die Medien kennzeichnen. Es ist erfreulich, solche nüchternen Analysen zu lesen. Sie helfen zu einem besseren Verständnis und zu einem sachlicheren Umgang mit einem schwierigen Thema. Die F.A.Z. hat nicht nur in ihrer Redaktion viele kluge Köpfe, sondern auch in ihrer Leserschaft. Glücklicherweise melden sie sich immer wieder zu Wort und bereichern diese hervorragende Zeitung, die ich seit mehr als fünfzig Jahren lese.
Hans-Joachim Heil, Fischbach bei Dahn Zur Kritik von Heike Hupertz „Für die Schöllacks hat es sich ausgetanzt“ (F.A.Z. vom 12. Januar) über den Dreiteiler „Ku’damm 77“ im ZDF ist noch Folgendes anzumerken: Trotz der unverhohlenen Warnung durch Frau Hupertz haben wir als eingefleischte Konsumenten der öffentlich-rechtlichen Programme drei Abende mit dieser Serie verbracht. Was hier dem Rundfunkbeitrag zahlenden Bürger für sein Geld geboten wird, schreit zum Himmel und zwingt zu der Überlegung, die Programmierung der eigenen Senderauswahl-Liste zugunsten der privaten Sender zu korrigieren, wohl wissend: Schlimmer geht immer! Was denken sich Programmverantwortliche und Intendanz beim Durchwinken solchen Flachsinns? Bildungsauftrag für die Nation – Danke!
Karl F. Lotz, Bad Wiessee Ein Messerangreifer hat einen Beamten am Triumphbogen attackiert. Daraufhin erschießt ein anderer Gendarm den Angreifer. Die Anti-Terror-Behörde ermittelt. Der langjährige Antisemitismusbeauftragte Felix Klein wechselt im Sommer auf einen neuen Posten. Im Interview erklärt er, wie es dazu kam. Der französische Präsident verteidigt Europa gegen Kritik +++ Merz und Wadephul treffen US-Außenminister Rubio +++ Merz: „Der Kulturkampf der MAGA-Bewegung ist nicht unserer“ +++ alle Neuigkeiten im Liveblog",8178,71,"CSU-Klausurtagung +++ Lob, Carlo Emilio Gaddas, Dieter Gamber, Eckart Lohse, Eva Fack, F.A.Z., Matthias Wyssuwa, Merz, Sebastian Siemer, Stephan Löwenstein, Timo Frasch, Wolf, ZDF",13,
