URL,Source,Language,Published_Date,Is_Premium,Keyword_Matched,Article_Classification,Headline,Intro,Content,Content_Length,Sentence_Count,Actors,Actor_Count,Author
https://www.faz.net/aktuell/wirtschaft/immobilien-wohnen/bauen-kaufen/klimawandel-trifft-die-alpen-was-das-fuer-kaeufer-von-ferienhaeusern-bedeutet-accg-110831882.html,FAZ,de,"12.02.2026, 18:47",False,klimawandel,Climate_Geopolitics,Klimawandel trifft die Alpen: Was das für Käufer von Ferienhäusern bedeutet,Abstürzende Hänge und überflutende Bäche: Der Klimawandel trifft die Alpen. Käufer von Ferienhäusern müssen aufpassen.,"Abstürzende Hänge und überflutende Bäche: Der Klimawandel trifft die Alpen. Käufer von Ferienhäusern müssen aufpassen. Der Klimawandel ist überall spürbar. Hitzewellen, Überschwemmungen und Trockenperioden fordern ihren Tribut. Bergregionen leiden besonders: Felsabbrüche, Hangrutsche und überschießende Bäche verursachen massive Zerstörungen. Vor allem die Schweiz erlebte in der jüngeren Vergangenheit schwere Bergstürze, zum Beispiel in Blatten und Brienz. Andererseits lebt der Traum vom Häuschen in den Bergen oder zumindest einer Zweitwohnung weiter. Doch beim Kaufentscheid sind Naturgefahren einzubeziehen. Lithium war als kritischer Batterierohstoff bislang unersetzlich. Doch nun gibt es eine Alternative. Sie ist auch für Europa und seine Industrie eine Chance. BASF-Chef Markus Kamieth ist derzeit Präsident des europäischen Chemieverbands Cefic. Im Gespräch zeichnet er ein düsteres Bild der Lage der Industrie. Von den Regierungschefs der EU fordert er schnelle Reformen. Die vier großen US-Techkonzerne wollen in diesem Jahr 650 Milliarden Dollar in KI-Rechenzentren investieren. Hat es ähnlich hohe Infrastrukturinvestitionen schon mal gegeben? Eine Spurensuche.",1178,18,"Batterierohstoff, Bergstürze, KI-Rechenzentren, Lithium, Markus Kamieth, Regierungschefs der EU",6,"Dunsch,Jürgen"
https://www.faz.net/aktuell/wirtschaft/duh-co-vor-bundesverwaltungsgericht-gewaltenteilung-im-klimaschutzstress-110833627.html,FAZ,de,"12.02.2026, 11:32",False,klimawandel,Climate_Geopolitics,DUH & Co: vor Bundesverwaltungsgericht: Gewaltenteilung im Klimaschutzstress,"Umwelt- und Menschenrechtsorganisationen wollen die Politik mithilfe der Gerichte zu mehr Klimaschutz zwingen. Doch der hat nicht immer Vorrang, und es müssen Interessen abgewogen und ausgeglichen werden.","Umwelt- und Menschenrechtsorganisationen wollen die Politik mithilfe der Gerichte zu mehr Klimaschutz zwingen. Doch der hat nicht immer Vorrang, und es müssen Interessen abgewogen und ausgeglichen werden. Entspannen Sie im Paradies“, wirbt das Tourismusbüro der niederländischen Karibikinsel Bonaire. Für die Bewohner Bonaires allerdings ist die Lage aufgrund des Klimawandels zunehmend angespannt: Der Meeresspiegel steigt, Wetterextreme nehmen zu, die touristisch wichtigen Korallenriffe sind bedroht. Nun müssen die Niederlande einen Klimaanpassungsplan für Bonaire erstellen und weitere Maßnahmen zum Schutz der Bewohner ergreifen, wie ein Bezirksgericht im fernen Den Haag entschied. Als Vorbild diente das Klimaurteil des Europäischen Gerichtshofs für Menschenrechte, das der Verein Klimaseniorinnen 2024 gegen die Schweiz erstritten hatte. Lithium war als kritischer Batterierohstoff bislang unersetzlich. Doch nun gibt es eine Alternative. Sie ist auch für Europa und seine Industrie eine Chance. BASF-Chef Markus Kamieth ist derzeit Präsident des europäischen Chemieverbands Cefic. Im Gespräch zeichnet er ein düsteres Bild der Lage der Industrie. Von den Regierungschefs der EU fordert er schnelle Reformen. Die vier großen US-Techkonzerne wollen in diesem Jahr 650 Milliarden Dollar in KI-Rechenzentren investieren. Hat es ähnlich hohe Infrastrukturinvestitionen schon mal gegeben? Eine Spurensuche.",1410,16,"Batterierohstoff, Europäischen Gerichtshofs für Menschenrechte, KI-Rechenzentren, Lithium, Markus Kamieth, Regierungschefs der EU",6,"Gelinsky,Katja"
https://www.faz.net/aktuell/wirtschaft/klima-nachhaltigkeit/energiewende-in-deutschland-weniger-rueckhalt-laut-umfrage-accg-200527141.html,FAZ,de,"11.02.2026, 05:25",False,klimawandel,Climate_Geopolitics,Energiewende in Deutschland: Weniger Rückhalt laut Umfrage,"In Deutschland fossile Energieträger schrittweise durch erneuerbare Energien zu ersetzen, fand bis 2022 jeder Zweite richtig. Heute ist es nur noch jeder Dritte. Wie Befragte ihre Haltung begründen.","In Deutschland fossile Energieträger schrittweise durch erneuerbare Energien zu ersetzen, fand bis 2022 jeder Zweite richtig. Heute ist es nur noch jeder Dritte. Wie Befragte ihre Haltung begründen. In Deutschland gibt es laut einer Umfrage in der Bevölkerung weniger Rückhalt für die Energiewende und den Klimaschutz. Der Anteil derer, die sich große Sorgen über die Folgen des Klimawandels machen, ist in den vergangenen Jahren deutlich gesunken, wie aus einer repräsentativen Umfrage des Instituts für Demoskopie Allensbach im Auftrag der BMW Foundation Herbert Quandt hervorgeht. Während demnach dieser Anteil zwischen 2010 und 2019 von 29 auf 51 Prozent gestiegen ist und bis 2022 auf ähnlich hohem Niveau verharrte, verringerte er sich seither auf zunächst 36 Prozent und aktuell auf 33 Prozent. Die Gründe liegen dem Institut zufolge vor allem im Zusammenspiel multipler Krisen – von der Wirtschaftskrise über den Krieg in der Ukraine bis hin zu den als zunehmend unsicher eingeschätzten allgemeinen Perspektiven. „In der politischen Agenda der Bevölkerung haben die Themen äußere und innere Sicherheit, die wirtschaftliche Entwicklung sowie auch Fragen der Energieversorgung zurzeit einen wesentlich höheren Stellenwert als das Thema Klimaschutz.“ Eine Mehrheit von 43 Prozent halte die Entscheidung, aus der Kernenergie auszusteigen und vor allem den Ausbau erneuerbarer Energien zu forcieren, für den richtigen Weg – 37 Prozent halten den eingeschlagenen Weg dagegen für falsch. Besonders in Ostdeutschland, in den unteren Sozialschichten sowie unter den Anhängern von AfD und FDP gebe es weit verbreitete Kritik am eingeschlagenen Weg, so die Umfrage. Innerhalb eines Jahres habe sich unter den Befürwortern der Energiewende der Anteil derer, die den Eindruck haben, dass Deutschland bei der Umsetzung der Energiewende die richtigen Maßnahmen ergreift, von 52 auf 33 Prozent verringert. Umgekehrt habe sich der Kreis derjenigen, die Zweifel an den ergriffenen Maßnahmen äußern, auf 26 Prozent erhöht. Dabei verbinde die Bevölkerung die Energiewende tendenziell eher mit Risiken als mit Chancen: Für 37 Prozent der Befragten sei die Energiewende überwiegend mit Risiken verbunden, für 28 Prozent eher mit Chancen, für jeden Vierten glichen sich Chancen und Risiken aus. Ein Ergebnis der Umfrage ist aber auch: Zwei Drittel der Befragten erwarten, dass sich infolge der Energiewende das Landschaftsbild in Deutschland durch Windräder und neue Stromleitungen gravierend verändern wird. Auf der Münchner Sicherheitskonferenz geht es um Sicherheit und Wohlstand. Viele Menschen trauen den Versprechen der etablierten Parteien nicht mehr – und akzeptieren, wenn sich bewährte politische Strukturen ändern. Australien hat es, Spanien will es, viele Länder diskutieren es: ein Verbot sozialer Medien für Kinder und Jugendliche. Nun stellt Helena Virkkunen, Vizepräsidentin der EU-Kommission,  ein EU-weites Verbot in Aussicht. Der verurteilte Sexualstraftäter Epstein boxte sich aus einfachen Verhältnissen und mit einigen Tricks nach oben. Als Vermögensverwalter für Superreiche bewegte er sich in elitären Kreisen. Zwei seiner Kunden spielten eine herausragende Rolle.",3173,23,"AfD, BMW Foundation Herbert Quandt, EU-Kommission, Epstein, FDP, Helena Virkkunen, Instituts für Demoskopie Allensbach",7,
https://www.faz.net/aktuell/wissen/erde-klima/klimawandel-gefaehrdet-weideflaechen-existenzsorgen-fuer-viehhalter-110834157.html,FAZ,de,"10.02.2026, 17:40",False,klimawandel,Climate_Science,Klimawandel gefährdet Weideflächen: Existenzsorgen für Viehhalter,"Grasland ist Grundlage der Viehhaltung – doch die gerät ins Wanken. Der Klimawandel könnte mehr als die Hälfte der globalen Weideflächen unbrauchbar machen, mit dramatischen Folgen für Millionen Viehhalter.","Grasland ist Grundlage der Viehhaltung – doch die gerät ins Wanken. Der Klimawandel könnte mehr als die Hälfte der globalen Weideflächen unbrauchbar machen, mit dramatischen Folgen für Millionen Viehhalter. Grasland, auf dem der Mensch Rinder, Schafe, Ziegen und anderes Vieh hält, bildet die größte Produktionsfläche auf der Erde, gut ein Drittel der Landfläche wird so bewirtschaftet. Doch dieses System ist offenbar labiler, als viele glauben. Es verändert sich rasant, wie sich jetzt zeigt. Und blickt man in die Zukunft, wie das chinesische und deutsche Forscher unter Zuhilfenahme von historischen Weidedaten und aktuellen Klimamodellen gemacht haben, dürften die Existenzsorgen vieler Viehhalter und -betriebe rund um den Globus eklatant anwachsen. Auf unserem Nachbarplaneten haben Forscher ein Loch im Boden entdeckt. Es offenbart einen enormen unterirdischen Hohlraum. Pestizide setzen der Artenvielfalt zu. Denn die wirken immer stärker – und nicht nur gegen Schädlinge. In Skandinavien, China und Japan ist es allerdings gelungen, die Belastungen zu senken. Hoher Blutdruck ist ein stiller, unbemerkter Killer. Smartwatches können davor warnen. Wie gut sind diese Messungen?",1186,14,,0,"Müller-Jung,Joachim"
https://www.faz.net/aktuell/sport/mehr-sport/viel-risiko-wie-der-klimawandel-den-bergsport-veraendert-accg-110827158.html,FAZ,de,"03.02.2026, 06:26",False,klimawandel,Climate_Geopolitics,Viel Risiko: Wie der Klimawandel den Bergsport verändert,Einsteigen oder nicht? Der Klimawandel verändert den Bergsport und verlangt erhöhte Aufmerksamkeit. Laura Dahlmeier starb bei einem Steinschlag. Hat sie die Warnsignale am Laila Peak nicht gesehen?,"Einsteigen oder nicht? Der Klimawandel verändert den Bergsport und verlangt erhöhte Aufmerksamkeit. Laura Dahlmeier starb bei einem Steinschlag. Hat sie die Warnsignale am Laila Peak nicht gesehen? Ob im pakistanischen Karakorum-Gebirge, im Himalaja, in den südamerikanischen Anden und natürlich auch in den Alpen: Die klimatischen Veränderungen hinterlassen auf der ganzen Welt gerade in den Bergregionen gewaltige Spuren. Das Eis der Gletscher schmilzt massiv. In den Alpen ist das exemplarisch gut zu erkennen an der Pasterze. Die Pasterze, der größte Gletscher der Ostalpen am Fuß des Großglockners (3798 Meter), des höchsten Berges von Österreich, hat seit Mitte des 19. Jahrhunderts die Hälfte seiner Fläche eingebüßt. Und jedes Jahr wird das Eis weniger. 2011 wurde in Frankfurt einer der ersten Padel-Plätze Deutschlands gebaut. Seitdem zieht das Spiel im ganzen Land Sportler und Investoren an. Was reizt so viele Menschen an der Mischung aus Squash und Tennis? Das NFL-Finale ist politisch aufgeladen wie lange nicht. Kaum ein Spieler steht diesbezüglich so sehr im Fokus wie Christian Gonzalez. Weil er seine Wurzeln stolz zur Schau trägt – und 68 Millionen vertritt. Einmal unkonzentriert, schon sind beim Biathlon alle Medaillenchancen verschossen. Aber worauf kommt es an? Ein Olympiasieger und ein Schnellschütze über Erfolgsgeheimnisse und Schlangen im Training.",1378,18,"Christian Gonzalez, Laura Dahlmeier, NFL-Finale",3,"Geiger,Stephanie"
https://www.faz.net/aktuell/feuilleton/buecher/sachbuch/handeln-diktatoren-wirklich-gegen-den-willen-ihrer-buerger-110827181.html,FAZ,de,"30.01.2026, 19:11",False,klimawandel,Climate_Geopolitics,Handeln Diktatoren wirklich gegen den Willen ihrer Bürger?,"Wie funktionieren Diktaturen im Inneren? Der Autor Fritz B. Simon übersieht, dass auch autoritäre Regime auf eingespielte Verwaltungen und die Mitarbeit ihrer Bürger angewiesen sind.","Wie funktionieren Diktaturen im Inneren? Der Autor Fritz B. Simon übersieht, dass auch autoritäre Regime auf eingespielte Verwaltungen und die Mitarbeit ihrer Bürger angewiesen sind. Wie Diktaturen funktionieren, ist eine Frage, die seit sehr langer Zeit in vielen Disziplinen diskutiert wird. Der inzwischen emeritierte Professor für Führung und Organisation an der Universität Witten/Herdecke, Fritz B. Simon, wagt sich also, wie er selbst zu Beginn seines neuen Buches zugesteht, auf gut vorbereitetes Terrain. Die Innovationskraft seines Ansatzes sieht er zum einen in einer „systemtheoretischen“ Rekonstruktion der Funktionsweise von Diktaturen. Und zum anderen verspricht er eine fokussierte Sicht auf Diktaturen, die sich seines Erachtens auszeichnen durch „Willkürherrschaft“ und eine Regierungspraxis „gegen den Willen der Bevölkerung“. An beiden Ansprüchen scheitert dieses eigentümlich hemdsärmelige Werk. Simon orientiert sich beim Vergleich diktatorischer Regime nicht an seinen eigenen, bestenfalls vagen Definitionskriterien. Vielmehr widmet er sich schlicht denjenigen autoritären Herrschern und ihren Gewaltapparaten, die man umgangssprachlich als Diktatoren bezeichnen kann, ohne viel Widerspruch zu ernten. Es tauchen die üblichen Verdächtigen auf: Hitler, Mussolini, Stalin und Mao sowie ihre furchterregenden Brüder im Geiste aus der Semiperipherie (Franco, Salazar, Pinochet, Ceaușescu) und der Peripherie der Weltgesellschaft (Idi Amin, Mobutu, Saddam Hussein, Khomeini, Papa Doc Duvalier). All diese Regime konnten sich zumindest zeitweise der Unterstützung von großen Teilen der Bevölkerung sicher sein, und keine dieser Personen hätte regieren können ohne ein Mindestmaß an Berechenbarkeit in der Relation zwischen dem Autokraten, seinem engen Kreis und der staatlichen Verwaltung. Gerade aus soziologischer Sicht kann man etwa hochbürokratisierte, totalitäre und genozidale Regime nicht als Willkürherrschaften einzelner Machthaber rekonstruieren. Das Buch hätte davon profitiert, Diktaturen als eine sehr spezifische Form autoritärer Machtausübung zu beschreiben. Stattdessen präsentiert Simon schlicht ein personenzen­triertes Bestiarium autoritärer Herrschaft. Obwohl Simon sehr darum bemüht ist, soziale Strukturen „diktatorischer“ Herrschaft herauszuarbeiten und – auf der Basis von Biographien – Gemeinsamkeiten zwischen so unterschiedlichen Systemen wie dem deutschen Nationalsozialismus, einer postkolonialen Militärdiktatur des Typs Mobutu und einer sozialistischen Marionettendiktatur zu finden, bleibt der Ertrag dieses Vergleichs gering. Diktaturen, so lernt man, können sich durch Volksaufstände, Militärputsche, ausländische Interventionen oder als Folge von Bürgerkriegen verfestigen. Manche kommen durch Wahlen, manche durch inkrementelle Prozesse der Unterwanderung des Staates zustande. Diktatoren starten ihre Karrieren manchmal als Volkstribune, manchmal als verlängerter Arm etablierter Eliten und manchmal als koloniale Offiziere, die zur richtigen Zeit am richtigen Ort waren. Beinahe zwei Drittel des Buches erschöpfen sich in teils sehr detaillierten Darstellungen solcher Prozesse am Beispiel besonders anschaulicher Fälle, die allerdings rein deskriptiv und in ihrer Konventionalität beinahe schulbuchartig bleiben. Auch Simons „systemtheoretische“ Einordnung diktatorischer Regime grenzt teils an Trivialität. In Diktaturen sei die funktionale Differenzierung sozialer Systeme außer Kraft gesetzt, das heißt, Wirtschaft, Massenmedien, Wissenschaft, Recht, Erziehung und so fort sind unter politische Kontrolle gestellt und ihrer Autonomie beraubt. So lernt man es auch im Geschichts- oder Sozialkundeunterricht. Der systemtheoretische Mehrwert erschöpft sich größtenteils in der Verwendung eines schmückenden Jargons. So sei es in einer „hochkomplexen“ Welt schwierig, sich zurechtzufinden, und Diktatoren fungierten daher als „Entscheidungsprämissen“, die einem bestimmte Entscheidungen abnähmen. Es ist nicht einfach, Simons Buch einzuordnen. Ein Fachbuch ist es nicht, denn es orientiert sich nicht an aktuellen sozialwissenschaftlichen Debatten über gemeinsame Muster von Diktaturen, sondern an Biographien über Diktatoren und kommt auf dieser Basis zu wenig überraschenden Schlüssen. Stellenweise ist die Beschreibung derart generisch und das präsentierte Material derart allgemein bekannt, dass man sich fragt, warum der Autor all dies überhaupt für berichtenswert hält. Ein Sachbuch ist es aber auch nicht, denn dafür ist es zu detailverliebt, enzyklopädisch und sammelnd. Es ist, wie der Untertitel bereits ankündigt, ein Katalog. Aber was ist die Funktion einer solchen Zusammenschau des Altbekannten? Nicht minder verwundert liest man die letzten Seiten des Buches, auf denen Simon in einem bemerkenswert selbstsicheren Pessimismus den Klimawandel, soziale Medien, den Aufstieg der Tech-Giganten und Migration (insbesondere wegen der „zunehmenden Dürre“ und des dadurch „zunehmend unbewohnbaren globalen Südens“) zu einem apokalyptischen Vortex vermengt, der auch westliche Staaten demnächst in den Autoritarismus (oder die Diktatur?) ziehen werde. Man kann diese düstere Prognose ernst nehmen oder nicht – sie ist jedenfalls thematisch und konzeptionell völlig entkoppelt von den „Mustern“, die Simon davor beschrieb. Zumindest die Funktion dieser abschließenden Kassandrarufe ist aber klar: Sie sollen das Buch anschlussfähig machen für besorgte öffentliche Debatten über den Trumpismus, Putin und die AfD. Viel ist das nicht. Der Düsseldorfer Waschpulverhersteller Henkel wird 150 Jahre alt. In seinem neuen Buch blickt der Historiker Joachim Scholtyseck tief in die Unternehmensgeschichte mit Glanz, Krisen und  NS-Verstrickung. Der amerikanische Historiker Timothy Snyder zieht Parallelen zwischen Trumps Führungsstil und dem Dritten Reich. Doch es gebe auch Verbindungslinien zu Putin. Rico Puhlmanns Modefotografie und Karl Schmidt-Rottluffs Malerei in Berlin, queere Moderne in Düsseldorf und Karl Hofer in Halle: Diese Ausstellungen schließen in den kommenden vier Wochen.",6046,41,"Diktatoren, Doc Duvalier, Franco, Fritz B. Simon, Hitler, Idi Amin, Khomeini, Mao, Mobutu, Mussolini, Pinochet, Saddam Hussein, Salazar, Simon, Simons, Stalin, Universität Witten/Herdecke, deutschen Nationalsozialismus",18,
https://www.faz.net/aktuell/feuilleton/debatten/das-ende-des-wachstums-110825597.html,FAZ,de,"27.01.2026, 15:20",False,klimawandel,Climate_Geopolitics,Das Ende des Wachstums,"Zum ersten Mal seit Jahrzehnten sinkt die Wohnfläche pro Person. Für die Umwelt ist das eine gute Nachricht. Es ist jedoch sehr ungleich verteilt, wer künftig auf Quadratmeter verzichtet.","Zum ersten Mal seit Jahrzehnten sinkt die Wohnfläche pro Person. Für die Umwelt ist das eine gute Nachricht. Es ist jedoch sehr ungleich verteilt, wer künftig auf Quadratmeter verzichtet. „Kleiner wohnen!“ hat sich bisher noch keine Partei getraut, auf ein Wahlplakat zu schreiben. Dabei wäre es ein maßgeblicher Beitrag zum Kampf gegen den Klimawandel, wenn die Deutschen auf weniger Quadratmetern lebten, denn das Wohnen ist für rund ein Drittel des CO2-Fußabdrucks jedes Bürgers verantwortlich. „Die Pause ist vorbei“ ist vieles auf einmal: ein Generationsporträt, ein Campusroman, vielleicht sogar ein Krimi. Und bei Millennials in Italien ein Kultbuch. Warum? Herbert Föttinger verabschiedet sich mit Shakespeares „Hamlet“ aus der Josefstadt. Stephan Müller inszeniert düster, mit starken Darstellern und prägnanten Kürzungen. Geburtstagskonfrontation in der Geburtsstadt: Das Albertinum in Dresden stellt Paula Modersohn-Beckers Werk dem Schaffen von Edvard Munch gegenüber. Aber leider nicht wirklich nebeneinander.",1022,13,"Edvard Munch, Herbert Föttinger, Partei, Paula Modersohn-Beckers, Shakespeares, Stephan Müller",6,"Lembke,Judith"
