URL,Source,Language,Published_Date,Is_Premium,Keyword_Matched,Article_Classification,Headline,Intro,Content,Content_Length,Sentence_Count,Actors,Actor_Count,Author
https://www.faz.net/pro/weltwirtschaft/weltwissen/donald-trump-wie-er-die-us-entwicklungspolitik-veraendert-accg-200452438.html,FAZ,de,"22.01.2026, 07:43",False,klimawandel,Climate_Geopolitics,Donald Trump: Wie er die US-Entwicklungspolitik verändert,"Washingtons Umgang mit der Entwicklungszusammenarbeit ist ein Sinnbild für das Vorgehen der USA auf der Weltbühne. Es zählen nur noch knallharte Eigeninteressen. Europa und Deutschland versuchen, trotz leerer Kassen eine Antwort zu finden.","Washingtons Umgang mit der Entwicklungszusammenarbeit ist ein Sinnbild für das Vorgehen der USA auf der Weltbühne. Es zählen nur noch knallharte Eigeninteressen. Europa und Deutschland versuchen, trotz leerer Kassen eine Antwort zu finden. US-Präsident Donald Trump ist ausgesprochen erfolgreich darin, neue Maßstäbe zu setzen. Einen kleinen Vorgeschmack gab der 20. Januar 2025.  Die 26 präsidentiellen Dekrete am ersten Tag seiner zweiten Amtszeit sind für sich genommen schon ein Rekord und zeigen: Eines der Hauptprobleme für Beobachter besteht darin, überhaupt einen Überblick zu behalten – darüber, was derzeit geschieht, was relevant sein könnte und was lediglich Nebelkerzen sind. Recht schnell erhielten das Thema US-Entwicklungshilfe und die De-facto-Abwicklung von USAID, der zentralen entwicklungspolitischen Agentur, einige Aufmerksamkeit: Kann es wirklich sein, dass Präsident Trump und Elon Musk – zeitweilig höchster Repräsentant für angeblich effizientes Regierungshandeln in Form der neu geschaffenen Behörde DOGE – die amerikanische Entwicklungspolitik einfach einstampfen? Die Schockstarre ging sogar über die kleinen entwicklungspolitischen Fachkreise hinaus, weil recht schnell deutlich wurde: dieses Vorgehen gegenüber Mitarbeitenden der Regierung, gegenüber internationalen Vereinbarungen und dem Wert von Vertrauen gegenüber internationalen Partnern könnte womöglich auch auf andere Bereiche amerikanischer Politik übertragen werden. Dieser Text stammt aus F.A.Z. PRO Weltwirtschaft. Erhalten Sie jeden Donnerstag das Briefing mit allem Wichtigen zu Globalisierung, Sicherheit und Ressourcen. Zusätzlich können Sie auf alle FAZ+ Artikel zugreifen. Die vergangenen Monate und Wochen haben gezeigt: Alle gängigen Worst-Case-Szenarien zu den innen- und außenpolitischen Veränderungen wurden bei Weitem übertroffen. Entwicklungspolitische Themen lassen sich im Rückblick als früher Gradmesser für die Disruptionsversessenheit der gegenwärtigen US-Administration verwenden. Das Trump-Dekret vom 20. Januar 2025 zur dreimonatigen Unterbrechung und Überprüfung der amerikanischen Entwicklungszusammenarbeit war kein in irgendeiner Form angelegter Prozess kritischer Reflexion, sondern ein in weiten Teilen mit Verschwörungstheorien scheinlegitimiertes Unterfangen, um einen völligen Kahlschlag noch ein wenig zu bemänteln. So teilte Musk Anfang Februar 2025 ein Video, das angeblich zeigt, dass USAID Millionen von Dollar an Prominente wie Angelina Jolie und Ben Stiller gezahlt habe, damit sie die Ukraine besuchen und dazu beitragen, die Popularität von Präsident Wolodymyr Selenskyj zu steigern. Zum derzeitigen Umfang der Entwicklungszusammenarbeit der USA lassen sich kaum belastbare Aussagen treffen. Bis einschließlich 2024 waren die USA mit Abstand der größte Geber; im letzten Jahr der Biden-Administration stellten sie noch fast 66 Milliarden Dollar bereit und damit knapp ein Drittel der gesamten Entwicklungshilfe der Vereinigung der führenden Industrieländer (Organisation for Economic Co-operation and Development, OECD). In den kommenden Wochen wird sich zeigen, ob die US-Administration überhaupt noch ein Interesse daran hat, ihre Entwicklungsleistungen zu melden, und erst dann wird man bewerten können, wie massiv die vermuteten Kürzungen im vergangenen Jahr tatsächlich waren. Das, was von der früheren entwicklungspolitischen institutionellen Infrastruktur noch erhalten ist, hat im besten Fall nur noch in sehr entfernter Weise etwas mit der nachhaltigen Entwicklung von Partnerländern zu tun. So werden derzeit die Millennium Challenge Corporation (MCC) und die Development Finance Corporation (DFC) seit einigen Monaten neu ausgerichtet, eine rein eigeninteressengeleitete Geoökonomie mit bestehenden Institutionen umzusetzen. Hier geht es unter anderem um den Zugang zu kritischen Rohstoffen für die USA. In den vergangenen Wochen hat die US-Administration außerdem einige Gesundheitsvereinbarungen, unter anderem mit Kenia und Malawi, vorbereitet. Es wäre zu voreilig, dies als positive Neuigkeit zu werten, denn offenbar könnten auch diese Projekte letztlich den Eigennutzen der USA in den Vordergrund stellen – etwa, indem der Zugang zu Gesundheitsdaten betont wird. Schon frühzeitig hat die Trump-Administration deutlich gemacht, dass sie sich nicht allein ignorant gegenüber internationalen Zielvereinbarungen zu globalen Nachhaltigkeitsfragen verhält, sondern diese aggressiv bekämpft. Die insgesamt recht unverbindlichen Vereinbarungen der internationalen Agenda 2030 und der damit verbundenen 17 Nachhaltigkeitsziele (Sustainable Development Goals, SDG) sind aus dieser Perspektive als Eingriff in staatliche Souveränität und als antiamerikanischer Versuch von „soft global governance“ zu betrachten. Trumps Administration übt erheblichen Druck auf internationale Akteure aus, Begriffe und Konzepte wie „Klimawandel“ und „geschlechtsspezifische Gewalt“ und „Diversität“ zu streichen, sei es bei den Vereinten Nationen, sei es bei der Weltbank oder OECD. Internationale Organisationen passen insgesamt kaum in das Wunschbild von Donald Trump, bestenfalls als dessen Erfüllungsgehilfen und nur im Sinne von deren angeblichen Kernmandaten im Sinne eines extremen Weltbildes der US-Regierung. Daher ist es fraglich, ob der von Trump angekündigte Austritt der USA aus 66 internationalen Einrichtungen wirklich immer ein schlimmer Verlust sein muss. Immerhin bieten sich in diesen Fällen weniger Möglichkeiten, dass die USA diese Einrichtungen von innen heraus versuchen zu zerstören. „Globale Politik minus eins“ kann daher auch als Chance verstanden werden, wie eine Strategie gegenüber den USA aussehen kann, wenn es ansonsten weiterhin einen breiten Konsens gibt. Europa tut sich schwer, der trumpschen Zerstörung in der Entwicklungspolitik und anderswo etwas entgegenzusetzen. Die finanzielle Lücke in der Entwicklungszusammenarbeit durch den Ausfall der USA lässt sich nicht schließen. Der Druck auf die öffentlichen Haushalte hat hierzulande enorm zugenommen – nicht zuletzt wegen der erforderlichen Zuwächse bei den direkten und indirekten Verteidigungsausgaben. Und die Zweifel am Sinn der Entwicklungszusammenarbeit haben sich bereits vor Trumps zweiter Amtszeit populistische Parteien in Deutschland (Stichwort: „Radwege in Peru“) und anderswo in Europa als vergleichsweise leichtes Ziel politischer Angriffe zunutze gemacht. In Deutschland hat Entwicklungsministerin Reem Alabali Radovan (SPD) vor wenigen Tagen den Reformplan „Zukunft gemeinsam gestalten“ vorgestellt, der „wertegeleitet und interessenbewusst“ sein will. Auch hier zeigt sich: Die internationalen Erwartungen an Deutschland als nunmehr größten Geber sind hoch, innenpolitisch steht das Politikfeld jedoch unter Druck und soll stärker handfeste Eigeninteressen Deutschlands berücksichtigen. Zugleich lassen die Haushaltsdebatten erwarten, dass im kommenden Jahr erneut mit einem sinkenden Etat zu rechnen ist. Gleichwohl könnte gerade dieses Politikfeld ein wichtiger Baustein sein, um die Beziehungen zu Akteuren im Globalen Süden auszubauen in einer Zeit, in der Europa und Deutschland mehr denn je auf internationale Partner angewiesen sind. Für Berlin spielten die Inselstaaten im Südpazifik bislang keine zentrale Rolle. Dabei gäbe es gute Gründe dafür – von der Konkurrenz mit China bis hin zur Klimapolitik. Allerdings sollten die deutschen Diplomaten mehrere Fehler nicht wiederholen. Die USA sind kein verlässlicher Partner mehr. Da richtet sich der Blick nach Asien. Auf der Münchner Sicherheitskonferenz geht es um Sicherheit und Wohlstand. Viele Menschen trauen den Versprechen der etablierten Parteien nicht mehr – und akzeptieren, wenn sich bewährte politische Strukturen ändern.",7717,50,"Angelina Jolie, Ben Stiller, Challenge Corporation, DFC, DOGE, Development Finance Corporation, Donald Trump, Elon Musk, MCC, Musk, OECD, Organisation for Economic Co-operation and Development, Trump, USAID, Vereinigung der führenden Industrieländer, Washingtons, Wolodymyr Selenskyj",17,
https://www.faz.net/aktuell/rhein-main/region-und-hessen/hessen-cdu-und-gruene-streiten-ueber-klimaschutz-200460543.html,FAZ,de,"21.01.2026, 18:16",False,klimawandel,Climate_Policy,Hessen: CDU und Grüne streiten über Klimaschutz,"Die hessischen Grünen werfen Umweltminister Ingmar Jung vor, eine Studie zum Klimaschutz zu vertuschen. Der CDU-Politiker weist die Kritik zurück und verweist auf die gestiegene finanzielle Förderung.","Die hessischen Grünen werfen Umweltminister Ingmar Jung vor, eine Studie zum Klimaschutz zu vertuschen. Der CDU-Politiker weist die Kritik zurück und verweist auf die gestiegene finanzielle Förderung. Der hessische Umweltminister Ingmar Jung (CDU) vertusche eine Studie zum Klimaschutz. Mit diesem Vorwurf hat die Vizepräsidentin des Landtags, Martina Feldmayer (Die Grünen), den Streit über die Frage fortgesetzt, wie wichtig der schwarz-roten Landesregierung das Thema ist. Jung habe die Untersuchung in Auftrag gegeben, weigere sich aber trotz Nachfragen, die Ergebnisse zu veröffentlichen, heißt es in einer Mitteilung. Influencer richten sich oft an ein junges Publikum – aber nicht nur. Niklas Hartmann sucht die Richtigen für seine Kunden. Der Markt für E-Autos wächst. Schon jetzt sind sie in einigen Fällen günstiger als vergleichbare Verbrennermodelle. Die neue Prämie kann sie noch attraktiver machen. Diese Rechnungen zeigen, für wen sich der Umstieg nun lohnt. Birken ade: Regisseur Philipp Preuss zaust Tschechows „Kirschgarten“ am Staatstheater Darmstadt bildstark, aber gefühlsarm.",1097,13,"CDU, Die Grünen, E-Autos, Ingmar Jung, Jung, Landtags, Martina Feldmayer, Niklas Hartmann, Philipp Preuss, Umweltminister, hessischen Grünen",11,
https://www.faz.net/aktuell/rhein-main/region-und-hessen/offenbach-will-wald-fit-fuer-die-zukunft-machen-200435103.html,FAZ,de,"15.01.2026, 15:39",False,klimawandel,Climate_Geopolitics,Offenbach will Wald fit für die Zukunft machen,Offenbach ist mit knapp 4500 Hektar die flächenmäßig kleinste Großstadt in Hessen. Knapp ein Drittel davon entfällt auf den für ein gutes Stadtklima wichtigen Wald.  Aber der braucht Hilfe.,"Offenbach ist mit knapp 4500 Hektar die flächenmäßig kleinste Großstadt in Hessen. Knapp ein Drittel davon entfällt auf den für ein gutes Stadtklima wichtigen Wald.  Aber der braucht Hilfe. Die Folgen des sich verändernden Klimas lassen sich nicht nur an Extremwetterereignissen und schmelzenden Gletschern ablesen. Auch die sich im Sommer mehr als je zuvor aufheizenden Innenstädte und eine unter Druck geratende Flora und Fauna zwingen zum Handeln.  Die Stadt Offenbach hat deshalb von der Frankfurter Planungsgesellschaft Natur & Umwelt ein ökologisches und forstwirtschaftliches Entwicklungskonzept für einen klimaresilienten Stadtwald erarbeiten lassen. Das soll von diesem Jahr an den jährlichen Waldwirtschaftsplan bestimmen. Influencer richten sich oft an ein junges Publikum – aber nicht nur. Niklas Hartmann sucht die Richtigen für seine Kunden. Der Markt für E-Autos wächst. Schon jetzt sind sie in einigen Fällen günstiger als vergleichbare Verbrennermodelle. Die neue Prämie kann sie noch attraktiver machen. Diese Rechnungen zeigen, für wen sich der Umstieg nun lohnt. Birken ade: Regisseur Philipp Preuss zaust Tschechows „Kirschgarten“ am Staatstheater Darmstadt bildstark, aber gefühlsarm. Flughafenredakteur und Korrespondent der Rhein-Main-Zeitung für Rhein-Main-Süd.",1286,16,"E-Autos, Frankfurter Planungsgesellschaft Natur & Umwelt, Niklas Hartmann, Philipp Preuss",4,
https://www.faz.net/aktuell/politik/inland/hunsrueck-wenn-es-den-gewinnern-der-energiewende-zu-viel-wird-110831902.html,FAZ,de,"08.02.2026, 20:45",False,klimakrise,Energy_Transition,Hunsrück: Wenn es den Gewinnern der Energiewende zu viel wird,"Der Hunsrück galt als Vorzeigeregion in Sachen Windkraft. Um Bundesziele zu erreichen, sollen noch mehr Anlagen entstehen. Kippt jetzt die Stimmung?","Der Hunsrück galt als Vorzeigeregion in Sachen Windkraft. Um Bundesziele zu erreichen, sollen noch mehr Anlagen entstehen. Kippt jetzt die Stimmung? Die Energiewende brachte Wohlstand in den Hunsrück. Viele Dörfer haben die Pachteinnahmen aus der Windkraft investiert: ein neuer Sport- und Fitnesspark in Neuerkirch (340 Einwohner) sowie E-Bikes und ein E-Auto zur kostenlosen Ausleihe. In Mörsdorf (650 Einwohner) baute man für 400.000 Euro eine Hängebrücke. Sie zieht jedes Jahr Tausende Touristen an, die Parkgebühren fließen in den Gemeindehaushalt. Russland behauptet­ immer wieder, der ­eigene Sieg sei nur eine­ Frage der Zeit. Tatsächlich aber hat sich der russische ­Vormarsch ­verlangsamt. Nach dem amerikanischen Eklat im vergangenen Jahr richten sich die Blicke nun auf Außenminister Rubio. Was ist von der Münchner Sicherheitskonferenz zu erwarten? Donald Trump will Einfluss auf die Wahlen nehmen. Über die Washingtoner Manöver wundern sich inzwischen selbst republikanische Wahlleiter. Welche Hebel hat der US-Präsident? Korrespondent für Hessen, Rheinland-Pfalz und das Saarland mit Sitz in Wiesbaden.",1117,15,"Donald Trump, Kippt, Rubio, Russland behauptet­",4,"Steppat,Timo"
https://www.faz.net/aktuell/wirtschaft/klima-nachhaltigkeit/comeback-des-erdoels-wenn-klimaschuetzer-zum-cheerleader-fuer-die-oelindustrie-werden-110788759.html,FAZ,de,"22.11.2025, 10:45",False,klimakrise,Climate_Economy,Comeback des Erdöls: Wenn Klimaschützer zum „Cheerleader für die Ölindustrie“ werden,Das Ende der fossilen Energie schien manchen schon besiegelt. Doch jetzt zeigt sich: Die Nachfrage droht noch jahrzehntelang zu wachsen.,"Das Ende der fossilen Energie schien manchen schon besiegelt. Doch jetzt zeigt sich: Die Nachfrage droht noch jahrzehntelang zu wachsen. Kanadas Regierungschef Mark Carney war mal ein Vorkämpfer gegen die Erderwärmung. Bis Anfang des Jahres war der frühere Notenbanker Sondergesandter der Vereinten Nationen für die Finanzierung des Klimaschutzes. Carney hat eine Initiative für marktwirtschaftlichen Klimaschutz in Unternehmen gestartet, und in seiner Zeit als Gouverneur der Bank von England war er 2015 der erste Notenbankchef, der auf die Gefahren des Klimawandels für die Finanzmärkte hinwies. Lithium war als kritischer Batterierohstoff bislang unersetzlich. Doch nun gibt es eine Alternative. Sie ist auch für Europa und seine Industrie eine Chance. BASF-Chef Markus Kamieth ist derzeit Präsident des europäischen Chemieverbands Cefic. Im Gespräch zeichnet er ein düsteres Bild der Lage der Industrie. Von den Regierungschefs der EU fordert er schnelle Reformen. Die vier großen US-Techkonzerne wollen in diesem Jahr 650 Milliarden Dollar in KI-Rechenzentren investieren. Hat es ähnlich hohe Infrastrukturinvestitionen schon mal gegeben? Eine Spurensuche. Redakteur in der Wirtschaft der Frankfurter Allgemeinen Sonntagszeitung.",1235,16,"Bank von England, Batterierohstoff, Carney, Frankfurter Allgemeinen Sonntagszeitung, KI-Rechenzentren, Lithium, Mark Carney, Markus Kamieth, Notenbankchef, Regierungschefs der EU, Vereinten Nationen",11,"Theurer,Marcus"
https://www.faz.net/aktuell/wissen/erde-klima/klimakonferenz-cop30-tuvalus-kampf-ums-kulturelle-ueberleben-accg-200254792.html,FAZ,de,"21.11.2025, 22:15",False,klimakrise,Climate_Geopolitics,Klimakonferenz COP30: Tuvalus Kampf ums kulturelle Überleben,"Tuvalu lässt es nicht geschehen: Der Klimawandel mag das Land verschlucken, Sprache, Werte und Kulturschätze aber sollen im digitalen Raum überleben. Nach dem Belém-Gipfel geht der Überlebenskampf in die nächste Runde.","Tuvalu lässt es nicht geschehen: Der Klimawandel mag das Land verschlucken, Sprache, Werte und Kulturschätze aber sollen im digitalen Raum überleben. Nach dem Belém-Gipfel geht der Überlebenskampf in die nächste Runde. Es ist friedlich. Die Menschen sind freundlich. Kriminalität gibt es praktisch nicht. Und man kann im klaren Meer schwimmen. Ich bin in Tuvalu geboren und aufgewachsen. Und ich habe deutliche Veränderungen des Wetters erlebt. Besonders durch den steigenden Meeresspiegel. Das Wasser drückt von unten durch. Große Teile der Insel erodieren bereits. An der Lagune haben wir versucht, Mangroven zu pflanzen, die von Springfluten niedergerissen wurden. Sie werden mit dem Klimawandel schlimmer. 2016 haben wir begonnen, Sand aus der Lagune nach oben zu pumpen, um die Insel zu erhöhen. In den folgenden Jahren wurde die Landzunge noch erweitert. Auf unserem Nachbarplaneten haben Forscher ein Loch im Boden entdeckt. Es offenbart einen enormen unterirdischen Hohlraum. Pestizide setzen der Artenvielfalt zu. Denn die wirken immer stärker – und nicht nur gegen Schädlinge. In Skandinavien, China und Japan ist es allerdings gelungen, die Belastungen zu senken. Hoher Blutdruck ist ein stiller, unbemerkter Killer. Smartwatches können davor warnen. Wie gut sind diese Messungen?",1291,24,,0,
https://www.faz.net/aktuell/politik/ausland/cop-30-lula-sucht-mitfahrer-fuer-seinen-klima-fahrplan-110786934.html,FAZ,de,"19.11.2025, 22:21",False,klimakrise,Climate_Geopolitics,COP 30: Lula sucht Mitfahrer für seinen Klima-Fahrplan,"Auf der Weltklimakonferenz will Brasilien zeigen, wie ein Ende für Kohle, Öl und Gas aussehen könnte. Präsident Lulas Fahrplan hat viele Unterstützer – aber längst nicht genug. Der Blick geht auch nach China.","Auf der Weltklimakonferenz will Brasilien zeigen, wie ein Ende für Kohle, Öl und Gas aussehen könnte. Präsident Lulas Fahrplan hat viele Unterstützer – aber längst nicht genug. Der Blick geht auch nach China. Das Gewitter kommt in Belém beinahe täglich, der Regen tropft dann in die Zelte, aber die Spannung auf der Weltklimakonferenz löst das nicht. Zwei Tage haben die Staaten noch Zeit, sich zu einigen. Aber gerade sind sie sich nicht einmal einig, über was sie sich eigentlich einigen sollen. Sollen sie einfach die letzten Fragen abarbeiten, die das Pariser Abkommen vor zehn Jahren den folgenden Konferenzen aufgeladen hatte? Dazu gehört zum Beispiel eine Liste, mit der man bestimmen soll, was eigentlich als Anpassung an den Klimawandel zählt. Oder sollen sie sich an die wirklich großen Fragen trauen angesichts der eskalierenden Klimakrise? Russland behauptet­ immer wieder, der ­eigene Sieg sei nur eine­ Frage der Zeit. Tatsächlich aber hat sich der russische ­Vormarsch ­verlangsamt. Nach dem amerikanischen Eklat im vergangenen Jahr richten sich die Blicke nun auf Außenminister Rubio. Was ist von der Münchner Sicherheitskonferenz zu erwarten? Donald Trump will Einfluss auf die Wahlen nehmen. Über die Washingtoner Manöver wundern sich inzwischen selbst republikanische Wahlleiter. Welche Hebel hat der US-Präsident?",1333,16,"Donald Trump, Lulas Fahrplan, Rubio",3,"Fuhr,Lukas"
https://www.faz.net/aktuell/politik/ausland/brasiliens-praesident-lula-cop30-ist-der-moment-der-wahrheit-accg-110766703.html,FAZ,de,"06.11.2025, 08:02",False,klimakrise,Climate_Geopolitics,Brasiliens Präsident Lula: COP30 ist der Moment der Wahrheit,"Bei jeder Klimakonferenz hören wir viele Versprechungen, sehen aber zu wenige echte Verpflichtungen. In Belém ist es Zeit für Aktionspläne statt Absichtserklärungen, meint der Gastgeber der 30. UN-Klimakonferenz.","Bei jeder Klimakonferenz hören wir viele Versprechungen, sehen aber zu wenige echte Verpflichtungen. In Belém ist es Zeit für Aktionspläne statt Absichtserklärungen, meint der Gastgeber der 30. UN-Klimakonferenz. Heute beginnt im brasilianischen Amazonasgebiet der Belém-Gipfel im Vorfeld der 30. Klimakonferenz der Vereinten Nationen (COP30). Ich habe die Staats- und Regierungschefs der Welt in den Tagen vor der COP einberufen, damit wir uns alle dazu verpflichten können, mit der Dringlichkeit zu handeln, die die Klimakrise erfordert. Russland behauptet­ immer wieder, der ­eigene Sieg sei nur eine­ Frage der Zeit. Tatsächlich aber hat sich der russische ­Vormarsch ­verlangsamt. Nach dem amerikanischen Eklat im vergangenen Jahr richten sich die Blicke nun auf Außenminister Rubio. Was ist von der Münchner Sicherheitskonferenz zu erwarten? Donald Trump will Einfluss auf die Wahlen nehmen. Über die Washingtoner Manöver wundern sich inzwischen selbst republikanische Wahlleiter. Welche Hebel hat der US-Präsident?",1021,11,"COP, COP30, Donald Trump, Rubio",4,
https://www.faz.net/aktuell/wirtschaft/klima-nachhaltigkeit/emissionshandel-auf-dieses-klimaziel-haben-sich-die-eu-staaten-geeinigt-accg-110764808.html,FAZ,de,"05.11.2025, 10:23",False,klimakrise,Climate_Geopolitics,Emissionshandel: Auf dieses Klimaziel haben sich die EU-Staaten geeinigt,Nach stundenlangen Beratungen haben sich die Umweltminister in Brüssel auf ein abgeschwächtes Klimaziel für 2040 geeinigt. Die EU-weiten CO₂-Preise in Gebäude und Verkehr sollen außerdem erst später eingeführt werden.,"Nach stundenlangen Beratungen haben sich die Umweltminister in Brüssel auf ein abgeschwächtes Klimaziel für 2040 geeinigt. Die EU-weiten CO₂-Preise in Gebäude und Verkehr sollen außerdem erst später eingeführt werden. Einmal im Jahr bekommt die internationale Klimapolitik ihre ganz große Bühne: auf der Klimakonferenz der Vereinten Nationen. Auch in diesen Tagen machen sich wieder Tausende Delegierte aus aller Welt auf den Weg zur „COP“, um darüber zu beraten, wie die Welt die Erderwärmung gegenüber dem vorindus­triellen Zeitalter möglichst auf 1,5 Grad Celsius beschränken kann. Doch wenige Tage vor Beginn der Verhandlungen im brasilianischen Belém ist die Ausgangslage noch schwieriger als in vielen Jahren zuvor. Lithium war als kritischer Batterierohstoff bislang unersetzlich. Doch nun gibt es eine Alternative. Sie ist auch für Europa und seine Industrie eine Chance. BASF-Chef Markus Kamieth ist derzeit Präsident des europäischen Chemieverbands Cefic. Im Gespräch zeichnet er ein düsteres Bild der Lage der Industrie. Von den Regierungschefs der EU fordert er schnelle Reformen. Die vier großen US-Techkonzerne wollen in diesem Jahr 650 Milliarden Dollar in KI-Rechenzentren investieren. Hat es ähnlich hohe Infrastrukturinvestitionen schon mal gegeben? Eine Spurensuche.",1285,14,"Batterierohstoff, COP, KI-Rechenzentren, Lithium, Markus Kamieth, Regierungschefs der EU",6,"Decker,Hanna;Fuhr,Lukas"
https://www.faz.net/aktuell/feuilleton/debatten/staedte-muessen-beim-klimaschutz-pragmatischer-handeln-accg-110711435.html,FAZ,de,"03.10.2025, 08:06",False,klimakrise,Climate_Geopolitics,Städte müssen beim Klimaschutz pragmatischer handeln.,"Große Aufgaben, begrenzte Mittel: Die Kommunen wurden mit Erwartungen überfrachtet, was sie zur Bewältigung der Klimakrise beitragen sollen. Vor allem Grünen-Politiker taten sich darin hervor. Die Zeichen deuten auf einen neuen Realismus.","Große Aufgaben, begrenzte Mittel: Die Kommunen wurden mit Erwartungen überfrachtet, was sie zur Bewältigung der Klimakrise beitragen sollen. Vor allem Grünen-Politiker taten sich darin hervor. Die Zeichen deuten auf einen neuen Realismus. Nicht weniger als „eine Einführung in die Kunst gesellschaftlichen Wandels“ versprach das Buch, das Uwe Schneidewind im Jahr 2018 veröffentlichte. „Die Große Transformation“ lautet der Titel des Werkes, in dem Schneidewind, der als Unternehmensberater, Universitätspräsident und schließlich als Chef des Wuppertal Instituts für Klima, Umwelt, Energie eine beachtliche Karriere hingelegt hatte, sein Programm für den Weg in eine nachhaltige Welt vorstellte. Man könnte neidisch werden: Während das Deutsche Fotoinstitut nicht vorankommt, erfindet sich das Nederlands Fotomuseum neu und bezieht in Rotterdam ein Lagerhaus der Jahrhundertwende. Der Einsatz von KI in Verwaltungen erreicht 2026 eine neue Stufe. Weg von reinen Pilotprojekten, wird die Technologie mehr und mehr in den Fachalltag von Bund, Ländern und Kommunen integriert. Die wachsende Bedeutung der Rüstungsindustrie zwingt traditionelle Industriezweige zum Umdenken. Wenn aus zivilen Betrieben militärische Produktionsstätten werden, entstehen neue Chancen – aber auch schwierige arbeitsrechtliche und organisatorische Fragen.",1330,12,"Deutsche Fotoinstitut, Uwe Schneidewind",2,"Alexander,Matthias"
