URL,Source,Language,Published_Date,Is_Premium,Keyword_Matched,Article_Classification,Headline,Intro,Content,Content_Length,Sentence_Count,Actors,Actor_Count,Author
https://www.faz.net/aktuell/technik-motor/technik/warum-der-klima-schneepflug-der-bahn-nichts-mit-dem-wetter-zutun-hat-accg-110826658.html,FAZ,de,"28.01.2026, 09:59",False,klima,Climate_Geopolitics,Warum der „Klima-Schneepflug“ der Bahn nichts mit dem Wetter zutun hat,"Der Klima-Schneepflug für die Bahn hat nichts mit ­dem Wetter zu tun, ­er ist nach seinem Erfinder benannt. Seit 100 Jahren ­befreit er Gleise von Schnee.","Der Klima-Schneepflug für die Bahn hat nichts mit ­dem Wetter zu tun, ­er ist nach seinem Erfinder benannt. Seit 100 Jahren ­befreit er Gleise von Schnee. Frost und Schnee bis weit ins Flachland hinein. Das Winterwetter macht den europäischen Eisenbahnen zu schaffen. Klingt nach Januar 2026, traf aber auch vor 100 Jahren zu. Damals stand die Schneeräumtechnik der Bahn vor einem Innovationssprung. Denn im Winter 1926/27 hatte in Österreich der Klima-Schneepflug Premiere. In Deutschland wurden erste Exemplare ab 1929 eingesetzt, Henschel in Kassel baute sie nach österreichischer Lizenz. Es gibt nur einen großen deutschen Skihersteller – Völkl. Der will sein Neongelb endlich wieder im Rennsport zum Leuchten bringen. Und auch sonst tut sich einiges unter dem neuen Chef. Die jüngste Apple Watch nutzt erstmals Redcap im 5G-Netz. Das ist abgespeckte Technik für längere Laufzeiten. Auch andere Anwendungen profitieren. Der Škoda Superb hat als Plug-in-Hybrid nicht nur steuerliche Reize. Aber es gilt, genau zu rechnen. Und auf die Jahreszeit zu achten.",1058,17,"Henschel, Klima-Schneepflug, Redcap, Völkl, europäischen Eisenbahnen",5,"Thomas,Peter"
https://www.faz.net/aktuell/wissen/erde-klima/konservativer-klimaschutz-110825575.html,FAZ,de,"01.02.2026, 16:10",False,klima,Climate_Geopolitics,„Konservativer“ Klimaschutz,Die Halb- und Unwahrheiten sind zum Schämen: Warum Fortschritte nur mit einem  neuen Realitätssinn erreicht werden.,"Die Halb- und Unwahrheiten sind zum Schämen: Warum Fortschritte nur mit einem  neuen Realitätssinn erreicht werden. Über die vergangenen zehn Jahre hat der Klimaschutz Fortschritte gemacht, aktuell aber weitet sich die Kluft zwischen wissenschaftlicher Erkenntnis und den Strategien und Ergebnissen politischen Handelns und Verhandelns. Vielerorts wird das Handeln aufgehoben, aufgeschoben oder verwässert. Je politisch konservativer die Entscheidungsträger, desto eher neigen sie zu Halbwahrheiten, wenn nicht Unwahrheiten, um klimaschädliche Strategien zu rechtfertigen. Ein extremes Beispiel findet sich aktuell in den USA, deren Regierung sich aus Pariser Ab­kommen, Weltklimarat (IPCC), Klimarahmenkonvention (UNFCCC) und auch Weltbiodiversitätsrat (IPBES) und Bio­diversitätskonvention (CBD) zurückzieht. Der Klimawandel wird zur Mei­nungs­sache degradiert und bis zur Realitätsverweigerung geleugnet. Da Emis­sionen aber weiterhin auf Rekordniveau sind, nehmen Schäden und Verluste, auch an Menschenleben, zu. Die USA nehmen sich auf Kosten aller Bürger dieser Welt Freiheiten, die nicht zu rechtfertigen sind. Auf unserem Nachbarplaneten haben Forscher ein Loch im Boden entdeckt. Es offenbart einen enormen unterirdischen Hohlraum. Pestizide setzen der Artenvielfalt zu. Denn die wirken immer stärker – und nicht nur gegen Schädlinge. In Skandinavien, China und Japan ist es allerdings gelungen, die Belastungen zu senken. Hoher Blutdruck ist ein stiller, unbemerkter Killer. Smartwatches können davor warnen. Wie gut sind diese Messungen?",1548,17,"CBD, Emis­sionen, IPBES, IPCC, UNFCCC",5,
https://www.faz.net/aktuell/wirtschaft/unternehmen/lidl-aldi-und-co-so-klimafreundlich-sind-deutsche-supermaerkte-accg-110825680.html,FAZ,de,"27.01.2026, 06:21",False,klima,Climate_Geopolitics,"Lidl, Aldi und Co.: So klimafreundlich sind deutsche Supermärkte",In einem europaweiten Vergleich zählen drei Ketten aus Deutschland zu den fünf nachhaltigsten. Aufatmen kann die Branche deswegen aber nicht.,"In einem europaweiten Vergleich zählen drei Ketten aus Deutschland zu den fünf nachhaltigsten. Aufatmen kann die Branche deswegen aber nicht. Für viele Menschen ist der Supermarktbesuch eine lästige Pflichtaufgabe. Doch der Einkauf hat enorme Auswirkungen auf die Umwelt und das Klima. Allein auf Ernährung gehen laut dem Umweltbundesamt im Durchschnitt 15 Prozent der Treibhausgasemissionen eines Deutschen zurück. Allerdings ist es für den Einzelnen eine fast unlösbare Herausforderung, all die verschiedenen Produkte hinsichtlich ihres CO2-Fußabdrucks zu vergleichen. Wäre es nicht viel leichter, die Supermärkte und Discounter übernähmen die Verantwortung für den Klimaschutz? Lithium war als kritischer Batterierohstoff bislang unersetzlich. Doch nun gibt es eine Alternative. Sie ist auch für Europa und seine Industrie eine Chance. BASF-Chef Markus Kamieth ist derzeit Präsident des europäischen Chemieverbands Cefic. Im Gespräch zeichnet er ein düsteres Bild der Lage der Industrie. Von den Regierungschefs der EU fordert er schnelle Reformen. Die vier großen US-Techkonzerne wollen in diesem Jahr 650 Milliarden Dollar in KI-Rechenzentren investieren. Hat es ähnlich hohe Infrastrukturinvestitionen schon mal gegeben? Eine Spurensuche.",1244,16,"Batterierohstoff, KI-Rechenzentren, Lithium, Markus Kamieth, Regierungschefs der EU",5,"Schwarz,Felix"
https://www.faz.net/aktuell/gesellschaft/gesundheit/plastik-wird-immer-mehr-lebensjahre-kosten-accg-200477703.html,FAZ,de,"27.01.2026, 06:14",False,klima,Climate_Science,Plastik wird immer mehr Lebensjahre kosten,"Der Plastikverbrauch droht sich bis 2060 zu verdreifachen. Bei Produktion, Transport und Entsorgung werden Schadstoffe freigesetzt. Wie viel gesunde Lebenszeit kostet das?","Der Plastikverbrauch droht sich bis 2060 zu verdreifachen. Bei Produktion, Transport und Entsorgung werden Schadstoffe freigesetzt. Wie viel gesunde Lebenszeit kostet das? Rauchen und Übergewicht zählen zu den Faktoren, die gesund verbrachte Lebenszeit kosten. Einer Studie zufolge gilt das auch für freigesetzte Stoffe aus dem Plastik-Lebenszyklus. Die Gesundheitsschäden durch Plastik-Emissionen könnten sich bis 2040 verdoppeln, berichtet das Team um Megan Deeney von der London School of Hygiene & Tropical Medicine im Fachjournal „The Lancet Planetary Health“. Rohstoffgewinnung, Produktion, Transport, Entsorgung – über den gesamten Lebenszyklus von Plastik werden Schadstoffe wie Treibhausgase, Feinstaub und krebserregende Chemikalien freigesetzt. Die Produktion sei dabei der relevanteste Faktor. Selbst im optimistischsten Szenario werde die Menschheit mehr gesunde Lebensjahre verlieren als derzeit, heißt es in der Studie. Wird der Lebenszyklus des Plastiks nicht verbessert, könnten der Analyse zufolge im Jahr 2040 geschätzt rund 4,5 Millionen gesunde Lebensjahre weltweit verloren gehen. Das entspräche rechnerisch etwa fünf Stunden verlorener voller Gesundheit für jeden Menschen auf der Erde, sagte Walter Leal von der Hochschule für Angewandte Wissenschaften Hamburg (HAW), der selbst nicht an der Berechnung beteiligt war. Mit anderen globalen Gesundheitsbelastungen verglichen sei die durch Plastik verursachte Krankheitslast damit zwar erheblich – aber weit geringer als die durch die allgemeine Luftverschmutzung mit jährlich geschätzt über 100 Millionen oder Malaria mit über 40 Millionen weniger gesunden Lebensjahren weltweit. „Sie ist jedoch vergleichbar mit der von Hepatitis B und unterstreicht die Notwendigkeit, diesem Thema Aufmerksamkeit zu schenken.“ Den Forschenden um Deeney zufolge könnte sich der globale Plastikverbrauch bis 2060 beim derzeitigen Stand politischer Maßnahmen und bei wachsender Bevölkerung fast verdreifachen. Damit nehmen die Auswirkungen auf Umwelt, Klima und menschliche Gesundheit zu. Der gesundheitliche Effekt wird bei Berechnungen in sogenannten DALYs - Disability-Adjusted Life Years – beziffert: entweder durch Tod oder durch Krankheit verlorene gesunde Lebensjahre. Die Forschenden untersuchten in ihrer Modellierungsstudie sechs Szenarien vom Weiter-wie-bisher bis hin zu optimistischen Annahmen mit besserem Abfallmanagement, mehr Recycling und reduzierter Plastiknutzung. Mehr verlorene gesunde Lebensjahre durch Schadstoffe aus dem Plastik-Lebenszyklus gibt es demnach selbst im optimistischsten Szenario. Die Plastikmasse im Jahr 2016 war der Analyse zufolge mit 2,1 Millionen DALYs für die Menschheit assoziiert. Im Alles-bleibt-Szenario würden im Jahr 2040 rund 4,5 Millionen DALYs verursacht, im optimistischsten Szenario wären es 2,6 Millionen. „Risikofaktoren, die laut der „Global Burden of Disease“-Studie für das Jahr 2016 eine von der Größenordnung her vergleichbare Krankheitslast aufweisen, wären Radon mit etwa 1,9 Millionen DALYs oder die berufsbedingte Belastung mit Asbest in Höhe von etwa 4,2 Millionen DALYs“, erklärte Dietrich Plaß vom Umweltbundesamt, selbst nicht an der aktuellen Berechnung beteiligt. Die wichtigsten gesundheitsschädlichen Auswirkungen sind diesen Daten zufolge globale Erwärmung und Feinstaub, die jeweils etwa ein Drittel der verlorenen gesunden Tage ausmachen. „Der Plastik-Lebenszyklus trägt mit etwa 4,5 Prozent zu den menschengemachten Treibhausgasemissionen bei und ist eine Hauptquelle für luftverschmutzende Partikel“, erklärte Leal. Damit sei sein Klimabeitrag größer als der des globalen Flugverkehrs, der bei etwa zwei Prozent liege. Das Team um Deeney nimmt an, dass die Zahl verlorener Tage in der Modellierung noch unterschätzt wird, weil gesundheitliche Effekte etwa durch Mikro- und Nanoplastik oder Kontakt mit schädlichen Substanzen bei der Nutzung von Plastikgegenständen nicht einbezogen wurden. Die Datenlage in diesen Bereichen sei bisher zu schwach. In diesem Fehlen sieht auch HAW-Wissenschaftler Leal eine Einschränkung der Aussagekraft. Die beiden Aspekte wegzulassen, bedeute eine erhebliche Unterschätzung. Auch bei den einbezogenen Aspekten gebe es teils noch große Datenlücken: „Es fehlen Informationen über Abfallmanagement und Emissionen, insbesondere in einkommensschwachen Ländern, was die Modellgenauigkeit beeinträchtigt.“ Auch lasse sich die Giftwirkung vieler freigesetzter Substanzen bisher noch nicht gesichert einschätzen. „Die Ergebnisse sollten also nur als eine erste und sehr unsichere Annäherung an die tatsächliche Krankheitslast interpretiert werden“, sagt auch Uba-Experte Plaß. Als einen Grund gibt er an, dass die Analyse auf einem veralteten Berechnungsmodell von 2016 basiere. Es sei davon auszugehen, dass neue Erkenntnisse über Zusammenhänge zwischen Schadstoffen und gesundheitlichen Auswirkungen – zum Beispiel Feinstaub und Diabetes Typ 2 – nicht einbezogen wurden. Zu bedenken gibt Leal auch, dass die Studie keine Nutzen-Kosten-Abwägung darstellt. Sie konzentriere sich allein auf die negativen Gesundheitsbelastungen im Zuge des Plastik-Lebenszyklus. Es gebe aber auch positive Effekte: „Plastik ist unverzichtbar für moderne Gesundheitsversorgung.“ Das gelte etwa mit Blick auf sterile Einwegartikel wie Spritzen, Implantate oder Blutkonserven. „In der Lebensmittelhygiene schützt es vor Keimen und Verderb, reduziert so Lebensmittelvergiftungen und sichert in vielen Regionen sauberes Trinkwasser.“ Die Studie sei daher „ein entscheidendes, aber unvollständiges Stück des größeren Bildes“. Unbekannte verschaffen sich über einen Lichtschacht Zutritt zur Bank. Die Höhe der Beute ist bislang unklar. Auf einem Parkplatz im nordrhein-westfälischen Grefrath wird ein junger Mann niedergestochen und lebensgefährlich verletzt. Ein Jugendlicher steht unter Verdacht. Auf dem 68. Wiener Opernball hat sich viel Prominenz versammelt. Auch Hollywoodschauspielerin Sharon Stone war zu Gast – und zeigte sich bewegt vom Ambiente.",5991,46,"Deeney, Dietrich Plaß, HAW, Hepatitis B, Hochschule für Angewandte Wissenschaften Hamburg, Leal, London School of Hygiene & Tropical Medicine, Megan Deeney, Szenario, Walter Leal",10,
https://www.faz.net/aktuell/gesellschaft/ungluecke/stromausfaelle-und-eisige-kaelte-durch-wintersturm-in-den-usa-accg-200472845.html,FAZ,de,"26.01.2026, 10:44",False,klima,Climate_Geopolitics,Stromausfälle und eisige Kälte durch Wintersturm in den USA,"Schnee und Kälte treffen die Vereinigten Staaten von Amerika: Nahezu 190 Millionen Menschen spüren die Folgen. Mehrere Menschen erfrieren, es kommt zu Stromausfällen.","Schnee und Kälte treffen die Vereinigten Staaten von Amerika: Nahezu 190 Millionen Menschen spüren die Folgen. Mehrere Menschen erfrieren, es kommt zu Stromausfällen. Beim winterlichen Unwetter in den USA sind weitere Menschen ums Leben gekommen. Die Zeitung „USA Today“ berichtete unter Berufung auf örtliche Behörden von mindestens 13 Toten in fünf US-Bundesstaaten seit dem Wochenende, der Sender CNN von mindestens elf. Die in den US-Medien genannten Zahlen schwankten, je nachdem, wie eindeutig die Todesursachen mit dem Extrem-Winter in weiten Teilen Nordamerikas in Zusammenhang gebracht wurden. Als vermutlich erfroren galten demnach fünf Menschen, die laut New Yorks Bürgermeister Zohran Mamdani am Wochenende in der Millionenmetropole tot im Freien gefunden wurden. Eine offizielle Todesursache wurde jedoch bisher nicht festgestellt. Tod durch Unterkühlung galt auch in den Fällen von drei Menschen in den US-Bundesstaaten Kansas, Michigan und Texas laut Behörden als wahrscheinlich. Deren Leichen wurden – teils nach stundenlanger Suche – jeweils in eisiger Kälte gefunden. Bereits am Sonntag hatte die zuständige Gesundheitsbehörde im Caddo Parish im Bundesstaat Louisiana den Tod zweier Männer an Unterkühlung gemeldet. Eisglätte und Sturm führten vielerorts zu schweren Verkehrsunfällen und Massenkarambolagen. In den südlichen Bundesstaaten Texas und Tennessee starben dabei mindestens zwei Menschen. In Tennessee meldeten die Behörden insgesamt drei Tote in Verbindung mit dem Wetter, wobei unklar war, inwiefern die Zahl der Behörden den Verkehrstoten einschloss. Ein heftiger Wintersturm zieht derzeit mit klirrender Kälte, Schnee und Eis über große Teile der USA und soll am Sonntag auch New York, Philadelphia und die Hauptstadt Washington entlang der US-Ostküste erfassen. Mehr als die Hälfte der US-Bevölkerung kämpft laut Behörden mit den zunehmenden Folgen des extremen Winterwetters – also nahezu 190 Millionen Menschen. Mehr als eine Million Haushalte waren am Sonntagabend vor allem im Süden des Landes von Ausfällen betroffen, wie die Übersichtsseite poweroutage.us, die Daten von Energieversorgern zusammenträgt, auflistete. In Tennessee waren es mehr als 330.000 Haushalte, in Mississippi mehr als 170.000, in Louisiana mehr als 140.000 und in Texas mehr als 90.000. Aber auch an der Ostküste waren Regionen betroffen. Ein Problem für die Energieversorgung ist die Last des Schnees und Eises auf den oberirdischen Leitungen. Auch umknickende Bäume können die Versorgung unterbrechen. Die andauernde extreme Kälte verhindere zunächst, dass Schnee und Eis schmelzen. Gleichzeitig stellten die Behörden am Sonntag möglicherweise „langanhaltende Stromausfälle“ in einigen Landesteilen in Aussicht. US-Meteorologen warnen seit Tagen vor einem der wohl größten Winterstürme der letzten Jahre. In mindestens 20 Bundesstaaten riefen die Behörden den Notstand aus, um, falls notwendig, deutlich schneller Hilfsgelder und Personal mobilisieren zu können. Aus dem Ort Crested Butte in Colorado, einer früheren Bergbausiedlung und beliebtem Ort für Wintersport, meldete CNN 58 Zentimeter Schnee. In Teilen Oklahomas seien bis zu 20 Zentimeter Schnee gefallen. Einige nutzen das winterliche Wetter auch, um draußen Spaß zu haben: Der Sender zeigte Bilder von Anwohnern, die sich in Oklahoma trotz eisiger Kälte amüsierten und auf Schlitten einen Hang hinunterrutschten. Aus Teilen von New Mexiko meldete CNN rund 30 Zentimeter Schnee, aus Texas bis zu 15 Zentimetern. Besonders gefährlich sei der gefrierende Regen, der in Teilen von Louisiana eine etwa zwei Zentimeter dicke Eisschicht hervorgebracht habe. Die Behörden warnten am frühen Sonntag zudem vor „katastrophalen“ Eisablagerungen in Mississippi. Auch die niedrigen Temperaturen sind demnach bedrohlich: So berichtete der Sender NBC News von gefühlten Temperaturen von minus 35 Grad Celsius in Teilen des Landes. Damit sei es ungewöhnlich kalt, selbst für diese Jahreszeit. Heftige Schneefälle führen laut Behörden zu Verkehrsbeeinträchtigungen und Sperrungen, von denen einige mehrere Tage andauern könnten. Eisanlagerungen erzeugten teilweise „extrem gefährliche“ Reisebedingungen. An mehreren großen Flughäfen wie in Washington, Philadelphia und New York wurden am Sonntag fast alle Flüge gestrichen. Der Internetseite Flightaware.com zufolge fielen landesweit fast 15.000 Flüge aus. Viele staatliche Behörden sollen am Montag geschlossen bleiben. Laut CNN wurden Autobahnen aufgrund gefährlicher Straßenbedingungen teilweise gesperrt. Der Sender berichtete von mehreren Unfällen, etwa in Kentucky. Die andauernde Kälte droht auch in den kommenden Tagen Teile des Landes lahmzulegen. Die Behörden riefen die Menschen auf, ihre Wohnungen möglichst nicht zu verlassen und das Auto stehenzulassen. In Washington waren die Menschen aufgerufen worden, Taschenlampen bereitzulegen und ihre Handys aufzuladen. In New York sollten laut NBC News in allen fünf Bezirken Zentren eröffnet werden, in denen sich Anwohner aufwärmen können. Der Sturm zieht seit Samstag über weite Teile der USA. Heimatschutzministerin Kristi Noem hatte im Vorfeld vor einem „historischen Wintersturm“ gewarnt. US-Präsident Donald Trump mahnte zu Vorsicht. „Bleiben Sie sicher und bleiben Sie warm“, erklärte er in seinem Onlinedienst Truth Social. Der bekennende Klimaskeptiker nahm den Sturm zudem zum Anlass, erneut seine Zweifel an dem Klimawandel zu äußern: „Könnten die Klima-Aufrührer mir bitte erklären: Was ist mit der Erderwärmung passiert?“ Die extreme Wetterlage wird ausgelöst durch eine Verformung des Polarwirbels, dadurch gelangt kalte Luft von der Arktis nach Süden. Wissenschaftler gehen davon aus, dass das gehäufte Auftreten dieses Phänomens mit dem Klimawandel zusammenhängen könnte. Eine gefährliche Kältewelle erfasst den Süden der USA. In North Carolina fallen örtlich Schneemengen, die zu den höchsten seit Beginn der Aufzeichnungen zählen. Wegen des Wintereinbruchs lassen einige Schulen den Präsenzunterricht am Mittwoch ausfallen. Am Flughafen Frankfurt läuft der Betrieb wieder störungsfrei. Der Deutsche Wetterdienst warnt weiterhin vor Glätte auf den Straßen. Millionen Einwanderer leben ohne Papiere in den USA. Ihr Steueraufkommen liegt bei hundert Milliarden Dollar pro Jahr. Donald Trump will sie am liebsten alle abschieben. Kann er das wirklich tun – und um wen geht es?",6355,62,"CNN, NBC News, USA Today, Zohran Mamdani",4,
https://www.faz.net/aktuell/rhein-main/region-und-hessen/kondensstreifen-auswirkungen-auf-das-klima-accg-200409807.html,FAZ,de,"26.01.2026, 05:17",False,klima,Climate_Science,Kondensstreifen: Auswirkungen auf das Klima,"Kondensstreifen fallen meist nur auf, wenn sie sich am blauen Himmel bilden. Doch auch wenn sie sich mit natürlichen Wolken vermischten, könne dies Folgen für das Klima haben, meinen Mainzer Forscher.","Kondensstreifen fallen meist nur auf, wenn sie sich am blauen Himmel bilden. Doch auch wenn sie sich mit natürlichen Wolken vermischten, könne dies Folgen für das Klima haben, meinen Mainzer Forscher. Neue Erkenntnisse von Forschern zur Entstehung von Kondensstreifen könnten beim Planen weniger klimaschädlicher Flugrouten helfen. Wie die Uni Mainz mitteilt, wurde untersucht, unter welchen Bedingungen sich aus Flugzeugabgasen langlebige Kondensstreifen bilden. Je nachdem, ob sie an wolkenfreiem Himmel oder in natürlichen Eiswolken entstehen, haben sie unterschiedliche Auswirkungen auf das Klima: Unter klaren Bedingungen oder in Verbindung mit sehr dünnen Eiswolken tragen sie eher zu höheren Temperaturen bei, weil sie einen Teil der von der Erde abgestrahlten Wärme zurückhalten, während einfallendes Sonnenlicht weitgehend durchgelassen wird. Sind die natürlichen Wolken dichter, verstärken zusätzliche Kondensstreifen die Reflexion des Sonnenlichts, sodass es zu einer leichten Abkühlung kommt. Aus Beobachtungsdaten schließen die Forscher, dass sich mehr als 80 Prozent aller Kondensstreifen in bestehenden Wolken bilden. Es könne daher sinnvoll sein, klimarelevante Flugrouten nicht nur nach wolkenfreiem Himmel, sondern auch mit Blick auf vorhandene Eiswolken zu planen. Für ihre Studie nutzten die Forscher Daten, die zwischen 2014 und 2021 von Verkehrsflugzeugen über dem Nordatlantik gesammelt worden waren. Diese Flugzeuge sind an einem europäischen Forschungsprojekt beteiligt und wurden für diesen Zweck mit speziellen Messgeräten ausgestattet. Das Landgericht Darmstadt hat ein Urteil über eine junge Frau gesprochen, die ihre Mutter tötete. Wegen ihrer seelischen Störung wird die Tochter in einer geschlossenen Klinik untergebracht. Die Ausländerbehörde ist die Behörde für Migranten, um Aufenthaltstitel zu erlangen. Dort zeigt sich, dass Integration kein einfaches, sondern ein kompliziertes Unterfangen ist. Und ihr fehlt das Personal. Nicht die psychische Belastung von Kindern und Jugendlichen hat sich binnen der vergangenen 20 Jahre verschlechtert, sondern der Umgang damit. Aus Angst, etwas falsch zu machen, geben viele Eltern früh Verantwortung ab.",2180,18,"Behörde für Migranten, Forschern, Uni Mainz",3,
https://www.faz.net/aktuell/wissen/leben-gene/arktis-klimawandel-sorgt-fuer-chaos-accg-110823300.html,FAZ,de,"25.01.2026, 14:59",False,klima,Climate_Geopolitics,Arktis: Klimawandel sorgt für Chaos,"Stürme, Wärme im Winter, Eiskrusten auf dem Schnee – der Klimawandel bringt das Wetter in der Arktis aus dem Takt. Was das für die Ökosysteme bedeutet.","Stürme, Wärme im Winter, Eiskrusten auf dem Schnee – der Klimawandel bringt das Wetter in der Arktis aus dem Takt. Was das für die Ökosysteme bedeutet. Normal ist heute nichts mehr. Zumindest nicht das Wetter der Arktis. Hier erhitzt sich das Klima viermal so schnell wie im Durchschnitt der Welt, viel schneller und stärker, als Forscher es noch vor zwanzig Jahren vorhergesagt haben. Und anders, als die Szenarien, die sie vor damals entworfen haben, führt die Erwärmung nicht einfach nur zum Ergrünen des hohen Nordens, machen Eis und Schnee nicht nur Moosen, Flechten und Büschen Platz. Der Klimawandel sorgt für extremes Wetter in der Region: Stürme werden häufiger, mitten im Winter fällt Sturzregen auf den Schnee, im Dezember taut das Eis auf den Gletschern. Mancherorts kommt es zu Dürren, der Permafrost taut, Feuer brechen aus, und Erdrutsche begraben die zarten Pflanzen der Tundra unter sich. Mit alldem müssen die Lebewesen der Polregion zurechtkommen. Auf unserem Nachbarplaneten haben Forscher ein Loch im Boden entdeckt. Es offenbart einen enormen unterirdischen Hohlraum. Pestizide setzen der Artenvielfalt zu. Denn die wirken immer stärker – und nicht nur gegen Schädlinge. In Skandinavien, China und Japan ist es allerdings gelungen, die Belastungen zu senken. Hoher Blutdruck ist ein stiller, unbemerkter Killer. Smartwatches können davor warnen. Wie gut sind diese Messungen?",1397,18,Normal,1,"Heinemann,Pia"
https://www.faz.net/aktuell/gesellschaft/gesundheit/amsterdam-verbietet-fleisch-reklame-200469419.html,FAZ,de,"23.01.2026, 16:54",False,klima,Climate_Geopolitics,Amsterdam verbietet Fleisch-Reklame,Keine Werbung mehr für Fleisch oder Flugreisen: Die Initiatoren sprechen von einem „wichtigen Sieg für das Klima und die öffentliche Gesundheit“.,"Keine Werbung mehr für Fleisch oder Flugreisen: Die Initiatoren sprechen von einem „wichtigen Sieg für das Klima und die öffentliche Gesundheit“. Wer im Sommer durch Amsterdam spaziert, wird dabei keine Werbung für Fleisch und fossile Energie entdecken: Von diesem Sommer an darf an Straßen, Plätzen und Haltestellen dafür keine Werbung mehr gemacht werden. Das gilt etwa für Hamburger, Kreuzfahrten, Dieselautos oder Flugreisen. Eine Mehrheit des Gemeinderats stimmte dem Verbot zu. Nach Angaben der Stadt ist Amsterdam damit die erste Hauptstadt weltweit, die Fleisch-Reklame verbietet. Die Grüne Partei GroenLinks, eine der Initiatoren des Verbotes, sprach von einem „wichtigen Sieg für das Klima und die öffentliche Gesundheit“. Die grüne Stadtabgeordnete Jenneke van Pijpen sprach auch von einem Zeichen vonseiten der Stadt: „Für Werbung großer Unternehmen, die die Klimakrise vorantreiben, ist in Amsterdam kein Platz mehr.“ Schon 2020 wollte Amsterdam sogenannte fossile Reklame verbieten. Doch bisher kam es nicht dazu. Denn Werbeverbote für Dienste oder Produkte, die fossile Energie nutzen und dem Klima schaden, gibt es bereits in anderen niederländischen Städten. Reklame für Fleisch wurde bisher nicht verboten. Im vergangenen Jahr hatte ein Gericht in Den Haag auch eine Klage von Reiseveranstaltern gegen das Werbeverbot abgewiesen. Unbekannte verschaffen sich über einen Lichtschacht Zutritt zur Bank. Die Höhe der Beute ist bislang unklar. Auf einem Parkplatz im nordrhein-westfälischen Grefrath wird ein junger Mann niedergestochen und lebensgefährlich verletzt. Ein Jugendlicher steht unter Verdacht. Auf dem 68. Wiener Opernball hat sich viel Prominenz versammelt. Auch Hollywoodschauspielerin Sharon Stone war zu Gast – und zeigte sich bewegt vom Ambiente.",1777,20,"Grüne Partei GroenLinks, Jenneke van Pijpen, Sharon Stone, Unbekannte",4,
